id,answer
CORP-TAX-001,"Die steuerliche Bemessungsgrundlage für die Körperschaftsteuer entspricht der Gewinn der Körperschaft im Sinne des Buchrechnungswesens, also dem Gewinn ohne Abzug der Kosten und Ausgaben."
CORP-TAX-002,"Ein zinsloses Darlehen von einer Körperschaft an einen Gesellschafter führt zu keinem direkten Steuerzuwachs für die Körperschaft, da der Betrag nicht als Gewinn erfasst wird. Dennoch kann dies in bestimmten Fällen zu Steuerersparnissen führen, je nach Umständen und Steuergesetzgebung. Es ist jedoch ratsam, den Fall bei einem Steuerberater durchzusprechen, um sicherzustellen, dass alle rechtlichen Aspekte berücksichtigt werden."
CORP-TAX-003,"Unternehmen mit Gewerkschaftsstatus sind verpflichtet, sämtliche Einkünfte den Einkünften aus dem Gewerbebetrieb zu zurechnen."
CORP-TAX-004,"(a) Bei der Tochtergesellschaft: Die Dividende ist als Gewinnsteuerlastiger Einkauf zu erheben und in den Gewinnsteuerjahrabschluss einzubeziehen.

(b) Bei der österreichischen Muttergesellschaft: Die Dividende ist als Gewinnsteuerfreier Einkauf zu erheben und als Auslandsgewinn zu steuern. Der Steuerbelastungskennwert beträgt 100%."
CORP-TAX-005,"Eine offene Ausschüttung wird im Sinne des Steuergesetzes als vollständig erfasst, während eine verdeckte Ausschüttung in der Regel nur teilweise erfasst wird. Die offene Ausschüttung ist ohne Vorbehalt zu erheben, während die verdeckte Ausschüttung möglicherweise mit Steuerabgaben belastet werden kann."
CORP-TAX-006,Der maximal mögliche Verlustabzug beträgt 180.000 € pro Jahr. Es gibt Ausnahmen wie bei Vermögensveränderungen oder bei bestimmten Gewerbe- und Handelsunternehmen.
CORP-TAX-007,"Ein Mantelkauf bezeichnet in Österreich einen Kauf von Waren, die im Rahmen des Lebensbedarfs der Erwerber oder der Erwerberin bestimmten Lebensabschnitts (z.B. Kinder, Pflegekräfte) bestimmt sind. Die Erwerbsteuer auf solche Waren ist geringer als bei anderen Kaufen."
CORP-TAX-008,"Ein Forderungsverzicht eines Gesellschafters einer Körperschaft führt im Steuerrecht zu folgenden Folgen:

1. Der Forderung wird der Körperschaft entzogen.
2. Die Körperschaft kann den Forderer nicht mehr verlangen, dass er die Schuldner des Gesellschafters an die Körperschaft bezahlt.
3. Der Gesellschafter, der das Forderungsverzicht durchführt, ist nicht verpflichtet, die Schuldner des Gesellschafters zu verfolgen oder zu bezahlen.
4. Der Gesellschafter, der das Forderungsverzicht durchführt, ist jedoch verpflichtet, dem Körperschaftsleiter die Gründe für das Forderungsverzicht zu berichten.

Diese Regelungen sind im Steuergesetz (StG) Absatz 10a und 10b belegt."
CORP-TAX-009,"Die Verlustverrechnung bei ausländischen Gruppenmitgliedern ist im Vergleich zu inländischen Gruppenmitgliedern komplexer und hängt von den internationalen Rechtsvorschriften ab. Inländische Gruppenmitglieder können ihre Verluste inländisch verrechnen, während ausländische Gruppenmitglieder oft zusätzliche Steuerbelastungen oder Einschränkungen haben müssen. Es gibt auch Unterschiede in den Regelungen bezüglich der Erstattung von Steuergutschriften und der Möglichkeit zur Verwendung von Steuerreserven."
CORP-TAX-010,"Ja, Steuerumlagen zwischen Gruppenträgern und Gruppenmitgliedern sind in der Regel steuerpflichtig. Diese Umlagen gelten als erworbene Einnahmen für das Gruppenmitglied und müssen daher gemäß den Steuergesetzen als Einkommen gemeldet und steuerpflichtig erfasst werden."
CORP-TAX-011,"Ja, Abschreibungen auf den niedrigeren Teilwert einer Beteiligung an einem Gruppenmitglied sind abzugsfähig, wenn sie in den Rahmen der Buchhaltung eines Unternehmens fallen und dem Steuerrecht entsprechen."
CORP-TAX-012,"Die Dividende einer ausländischen EU-Tochtergesellschaft mit einer Beteiligung von 15% und einer Dauer von zwei Jahren wird als ""gewöhnliche Dividende"" behandelt. Sie ist nicht als ""vorübergehende Dividende"" oder ""auslandliche Dividende"" zu ermitteln, da die Beteiligung unter 25% liegt und die Dauer weniger als drei Jahre beträgt. Daher muss sie normalerweise gemäß den EU-Steuerabkommen in der Einkommensteuer gemeldet und abgezogen werden."
CORP-TAX-013,"Beide Bestimmungen sind unterschiedliche Regelungen im Österreichischen Steuergesetz (ÖStG). § 10 KStG betrifft die Beteiligungsbefreiung von Gewerbe- und Handelsunternehmen, während § 12 Abs. 1 Z 10 KStG das Abzugsverbot für Lizenzgebühren regelt. Es ist möglich, dass der gleiche Konzern in verschiedenen Unternehmensabschnitten unterschiedliche Steuerbestimmungen beinhaltet, da die Gesetzgebung oft spezifisch für bestimmte Bereiche oder Unternehmen konzipiert ist. Daher kann es vorkommen, dass eine Firma sowohl unter § 10 KStG als auch unter § 12 Abs. 1 Z 10 KStG abgegrenzt wird."
CORP-TAX-014,"Eine internationale Schachtelbeteiligung erfordert, dass mindestens eine der beteiligten Unternehmen in einem derjenigen Staaten tätig ist, die den Schachtelprinzipien zustimmen, wie zum Beispiel den USA oder die EU-Staaten. Darüber hinaus muss es sich um eine komplexe Struktur handeln, bei der mehrere Unternehmen durch Schachtelungen miteinander verbunden sind, um Steuerbelastung zu minimieren. Es bedarf einer genauen Analyse der Geschäftsstruktur und der verwendeten Konzepte zur Bestimmung, ob eine Schachtelbeteiligung vorliegt."
CORP-TAX-015,"Veräußerungsgewinne aus internationalen Schachtelbeteiligungen werden in Österreich grundsätzlich als Einkommen aus der Heimatwirtschaft behandelt, wenn die Schachtelstruktur nicht als Schadenersatzstruktur gilt. Für solche Fälle gibt es spezielle Regelungen im Steuergesetz."
CORP-TAX-016,"Ja, Fremdfinanzierungszinsen für den Erwerb einer steuerbefreiten Beteiligung können als Betriebsausgabe abgezogen werden, wenn sie im Rahmen der Unternehmensfinanzierung eingesetzt wurden."
CORP-TAX-017,"§ 11 KStG bezieht sich auf den Betriebsausgabenabzug, wenn die Kosten für einen bestimmten Betrieb oder eine bestimmte Aufgabe erfasst werden. § 12 KStG hingegen betrifft den Betriebsausgabenabzug für spezielle Aufgaben oder Bereiche innerhalb eines Unternehmens."
CORP-TAX-018,"Ja, freiwillige Spenden zu gemeinnützigen Zwecken sind grundsätzlich abzugsfähig bei der Berechnung des Einkommenssteuersatzes."
CORP-TAX-019,"(a) EU-Geldbuße - nicht abzugsfähig  
(b) Spende an begünstigten Empfänger - nur teilweise abzugsfähig  
(c) Aufsichtsratsvergütung - nicht abzugsfähig  
(d) Lizenzgebühr an konzernzugehörige Gesellschaft mit 8 % Steuerbelastung - nur teilweise abzugsfähig"
CORP-TAX-020,"Lizenzgebühren an eine konzernzugehörige Gesellschaft sind in der Regel nicht abzugsfähig, wenn sie zur Nutzung eines wettbewerbsnützigen Güter oder Dienstleistungen erforderlich sind. Dies gilt insbesondere bei der Nutzung von technischen Geräten, Software oder anderen wettbewerbsnützlichen Ressourcen."
CORP-TAX-021,"Der Gewinn bei rechnungslegungspflichtigen Körperschaften wird nach dem Buchhaltungsrechensatz ermittelt. Dies bedeutet, dass der Gewinn aus den Einnahmen abzieht, welche Ausgaben und Steuern enthalten sind."
CORP-TAX-022,"Die §§ 7–12 KStG (Kaufvertragsgesetz) sind relevant, um zu prüfen, ob der Kauf den Bedingungen des § 8 KStG entspricht, die sich auf die Verhältnisse zwischen den Beteiligten beziehen. Insbesondere die §§ 7 (Berechtigung), 9 (Vertragsform), 10 (Vertragsinhalt) und 12 (Vertragsnachweis) müssen beachtet werden."
CORP-TAX-023,"Nach einem Verlustjahr muss die GmbH zunächst sicherstellen, dass sie ordnungsgemäß ihre Buchseitenbuchhaltung durchgeführt hat. Im Folgejahr kann sie dann versuchen, den Verlust mit Gewinn aus anderen Jahren abzudecken oder zu neutralisieren. Es ist wichtig, dass die Gewinne in den Jahren des Verlusts ordnungsgemäß gemeldet und belastet werden. In Ausnahmefällen kann das Steuererleichterungsrecht eingesetzt werden, um Steuern zu senken. Einzelheiten hängen von der Gesamtstruktur der Buchseiten und der spezifischen Umstände ab. Einzelberatung bei einem Steuerberater ist empfehlenswert."
CORP-TAX-024,"Der Gewinnermittlungszeitraum betrifft den Zeitpunkt, an dem das Steuernachweisen oder -erheben erfolgen muss. Er beträgt in der Regel 12 Monate nach dem Enddatum des Finanzierungszeitraums. Dieser Zeitraum kann jedoch durch besondere rechtliche Bestimmungen oder Vertragsvereinbarungen abgewichen sein."
CORP-TAX-025,"Einlagen und Beiträge von Gesellschaftern werden in der Regel als Einkommen des Gesellschaftsmitglieds gezählt, wenn sie zur Unterbringung oder Nutzung der Gesellschaft beitragen. Dies gilt insbesondere für Gelder, die direkt zur Erhöhung der Gesellschaftsleistung oder zur Finanzierung von Unternehmensaktivitäten verwendet werden. Bei Einlagen, die nicht direkt zur Unternehmung beitragen, kann es zu unterschiedlichen Behandlungen kommen, abhängig von den Umständen."
CORP-TAX-026,"Der Verlustabzug ist nicht auf 75 % begrenzt, wenn der Erwerb des Vermögens oder der Leistung der Leistungsleistung vor dem 1. Januar 2019 erfolgt hat."
CORP-TAX-027,Die Mindestbeteiligungsquote für eine finanzielle Verbindung im Sinne des § 9 KStG beträgt 10 %.
CORP-TAX-028,"Die Dauer der finanziellen Verbindung zu einem Gruppenmitglied kann je nach具体情况而定而定, aber in der Regel beträgt sie mindestens 12 Monate."
CORP-TAX-029,"Nein, Vorgruppenverluste, die aus Teilwertabschreibungen auf Beteiligungen an Körperschaften einer anderen Unternehmensgruppe resultieren, können nicht mit dem Gruppengewinn verrechnet werden. Dies würde eine Verstöße gegen das Prinzip der Unabhängigkeit von den Gewinn- und Verlustausgleichsverfahren bedeuten."
CORP-TAX-030,"Die unbeschränkte Steuerpflicht einer österreichischen Körperschaft führt zu der Folge, dass sie in beiden Staaten (Österreich und Deutschland) Steuern zahlen muss. Als Gruppenträger kann sie jedoch nicht unbeschränkt steuerpflichtig sein, da dies gegen das Gemeinsame Steuerabkommen zwischen Österreich und Deutschland verstößt. Daher muss sie in Deutschland einen Teilhaber oder eine andere Form von Gruppenteilhabe wählen, um die rechtliche und steuerliche Komplexität zu reduzieren."
CORP-TAX-031,"Vorgruppenverluste beziehen sich auf die Kosten, die eine Vorgruppe (z.B. eine AG) während ihrer Existenz erlitten hat, die nicht als Kosten der Unternehmensgruppe (z.B. des Unternehmens) gezählt werden können. Diese Kosten werden in den Buchseiten der Vorgruppe vermerkt, aber nicht als Kosten der Gesamtgruppe. Innerhalb der Gruppe werden diese Verluste normalerweise nicht direkt abgezogen, da sie nicht als tatsächliche Kosten der Gesamtgruppe betrachtet werden. Es gibt jedoch spezielle Regelungen im Steuergesetz, die es ermöglichen, dass diese Verluste in bestimmten Fällen als abzugreifende Kosten für die Unternehmensgruppe gelten können."
CORP-TAX-032,"Bei der Verlustverrechnung unterscheiden sich die Regelungen für inländische und ausländische Gruppenmitglieder hinsichtlich der Höhe, der Grenze und der Nachversteuerung:

1. **Höhe der Verlustverrechnung:**
   - Inländische Gruppenmitglieder können bis zu 50% des inländischen Gewinns verlustverrechnen.
   - Ausländische Gruppenmitglieder können bis zu 25% des inländischen Gewinns verlustverrechnen.

2. **Grenze der Verlustverrechnung:**
   - Für inländische Gruppenmitglieder gibt es keine speziellen Grenzen.
   - Für ausländische Gruppenmitglieder gibt es eine Grenze von 25% des inländischen Gewinns.

3. **Nachversteuerung:**
   - Bei inländischen Gruppenmitgliedern kann nachversteuerungsfrei gehaltene Verluste nicht mehr verlustverrechnet werden.
   - Bei ausländischen Gr"
CORP-TAX-033,"Ja, die Einjahresfrist gilt auch für Anteile aus Kapitalerhöhungen in internationalen Schachtelbeteiligungsgesellschaften."
CORP-TAX-034,"Die einschlägigen Normen sind das Steuergesetz (StG), das Steuererfolgsrecht (StErR) sowie das Gesetz zur Steuerung von Kapitalströmen (KapitalströmenG). Es ist wichtig, auch die Richtlinien der Finanzministeriums zu berücksichtigen, da sie oft umsetzungsfähige Anleitungen liefern."
CORP-TAX-035,Eine Beteiligung von 8% an einer deutschen GmbH ist nicht ausreichend für den Anspruch auf die internationale Schachtelbegünstigung. Die Schachtelbegünstigung kann nur für Unternehmen mit einer Beteiligung von mindestens 25% oder mehr an der GmbH geltend gemacht werden. Daher hat die Beteiligung von 8% keinen Einfluss auf die Steuerfreizügigkeit von Dividenden.
CORP-TAX-036,"Die Option zur Steuerwirksamkeit einer Schachtelbeteiligung bei einem konzerninternen Weiterverkauf im Rahmen einer Umgründung kann zu unterschiedlichen Steuerfolgen führen, abhängig von den spezifischen Umständen und rechtlichen Voraussetzungen. In der Regel kann dies zu einer Verlagerung der Steuerbelastung oder zu einer Vermeidung von Steuerbelastungen führen, je nachdem, wie die Umgründung strukturiert ist und welche Steuerbestimmungen angewendet werden. Es ist jedoch wichtig, dass solche Entscheidungen immer von einem beratenden Steuerberater getroffen werden, da es sich um komplexe und rechtlich spezifische Fragen handelt."
CORP-TAX-037,"Gewinnanteile aus ausländischen Schachtelbeteiligungen sind trotz des § 10 KStG steuerpflichtig, wenn sie als Teil der Gesamteinkommen eines Steuerpflichtigen erfasst werden und nicht als Teil von Ersparnissen oder Vermögenswerten. Dies gilt insbesondere, wenn die Gewinne aus den ausländischen Unternehmen stammen, die in einem anderen Mitgliedstaat der EU oder einer anderen OECD-Partnernation tätig sind."
CORP-TAX-038,"Körperschaftsspezifische Aufwendungen nach § 11 KStG als Betriebsausgaben sind u. a.:

- Kosten für die Erstellung von Unternehmensberichten und -aufstellungen
- Kosten für die Erstellung von Steuererklärungen
- Kosten für die Erstellung von Finanzberichten
- Kosten für die Erstellung von Rechnungslegungspapieren
- Kosten für die Erstellung von Buchhaltungsunterlagen
- Kosten für die Erstellung von Steuerabrechnungen
- Kosten für die Erstellung von Steueranträge
- Kosten für die Erstellung von Steuerbescheidungen
- Kosten für die Erstellung von Steuerbescheinigungen"
CORP-TAX-039,"Betriebsausgaben, die zur Erbringung von Wirtschaftsdienstleistungen erforderlich sind, sind nach § 12 KStG nicht als Betriebsausgaben abzugsfähig."
CORP-TAX-040,"Zinsen für konzerninterne Beteiligungsfinanzierungen sind in der Regel abzugsfähig, jedoch sind sie im Sinne des § 5 Absatz 1 Nr. 2 Buchstabe a des Steuergesetzes nicht abzugsfähig, wenn sie als Teil einer Beteiligungserstattung oder -zahlung verwendet werden."
CORP-TAX-041,Der Gewinn eines abweichenden Wirtschaftsjahres wird im Veranlagungsjahr erfasst.
CORP-TAX-042,"Das Einkommen einer Körperschaft wird nach den Gesetzestexten der Steuergesetzgebung berechnet. Es umfasst das Gesamteinkommen, das durch die Tätigkeit des Unternehmens erzielt wurde, einschließlich der Gewinne und der Erträge. Abzüge werden in Form von Kosten und Ausgaben vorgesehen, die zur Berechnung des Einkommens beitragen können. Diese Kosten und Ausgaben müssen jedoch dementsprechend nachgewiesen werden. Einzelheiten liegen im Steuervertrag und in den Gesetzestexten der Steuergesetzgebung."
CORP-TAX-043,Die §§ 7–12 des KStG (Kaufsteuergesetz) sind in diesem Zusammenhang nicht direkt relevant. Die Überleitung vom Handelsbilanzgewinn zum steuerpflichtigen Einkommen einer GmbH erfolgt hauptsächlich unter Berücksichtigung der §§ 13 bis 16 KStG.
CORP-TAX-044,"Ja, die Art der Einkommensverwendung kann Einfluss auf die Einkommensermittlung haben, insbesondere bei bestimmten Steuersätzen wie dem Steuersatz 25 %. Bei Einkommen, das als Ausschüttung oder in Form von Dividenden gezahlt wird, kann der Steuersatz 25 % höher sein als bei anderen Verwendungsmöglichkeiten des Einkommens."
CORP-TAX-045,"Nein, eine Körperschaft mit abweichendem Wirtschaftsjahr kann ihre Verlustvorträge nicht unbegrenzt mit dem Jahresgewinn verrechnen. Es gibt Grenzen in Form von Fristen und Voraussetzungen, die von der Finanzverwaltung festgelegt sind."
CORP-TAX-046,"Mantelkauf und Verlust von Verlustvorträgen unterscheiden sich in der Regel durch den Kontext und die rechtlichen Implikationen:

- Gemeinsamkeiten: Beide sind Steuerkonzepte, die im Rahmen des Kompensationssteuersachers (KStG) gelten.

- Unterschiede:
  - Mantelkauf bezieht sich auf den Kauf eines Mantels oder ähnlicher Kleidungsstücke, bei dem der Steuerbelastungswert nicht vollständig abzüglich wird.
  - Verlust von Verlustvorträgen betrifft das Rücktrittsrecht bei Gruppenversicherungen, bei dem der Steuerbelastungswert teilweise abzüglich wird, wenn das Rücktrittsrecht verloren geht."
CORP-TAX-047,"Eine Körperschaft kann nach einem Mantelkauf ihre Verluste grundsätzlich nicht mehr nutzen, da der Mantelkauf das Finanzierungsinstrument einer Körperschaft ist, bei dem sie sich selbst als Käufer oder Verkäufer versteht. Dies führt zu einer Vermeidung von Steuern, da die Verluste in der eigenen Körperschaft nicht mehr abgelehnt werden können.

Die Ausnahme besteht bei der Verwendung des Mantelkaufs zur Finanzierung von Unternehmensausgaben, wie z.B. Werbung oder Entwicklungskosten. In diesem Fall können die damit finanzierten Ausgaben als Kosten gewertet werden, was die Möglichkeit erlaubt, die damit verbundenen Verluste in der Körperschaft zu verarbeiten."
CORP-TAX-048,"Rückvergütungen von Erwerbs- und Wirtschaftsgenossenschaften gelten als Einkommensverwendung, wenn sie dem Mitglied zur Deckung der Lebenshaltungskosten oder zur Finanzierung von Lebensmitteln, Wohnungsmieten oder anderen notwendigen Lebensbedürfnissen dienen."
CORP-TAX-049,"Wenn ein ausländisches Gruppenmitglied die Unternehmensgruppe verlässt und zuvor zugerechnete Verluste im Ausland noch nicht verrechnet wurden, müssen diese Verluste in der Heimathebungsrechnung des verlassenen Mitglieds berücksichtigt werden. Dies kann zur Erhöhung des Steuerbelastens führen, da die zugrunde liegenden Verluste nicht mehr als solche abgelehnt werden können. Es ist ratsam, den Fall rechtzeitig dem Steuerberater oder dem Steueramt vorzulegen, um mögliche Maßnahmen zu identifizieren und zu berücksichtigen."
CORP-TAX-050,"Die Unternehmensgruppe kann durch die Nutzung von Gruppenrechnungen und -steuern in der Regel einen steuerlichen Vorteil erzielen, da sie möglicherweise auf höhere Steuerschranken zugreifen kann als eine isolierte Besteuerung. Darüber hinaus können Gruppenrechnungen dazu führen, dass bestimmte Kosten oder Einnahmen innerhalb der Gruppe neutralisiert werden, was zu einem gesamten Steuerkürzungsvermögen führen kann."
CORP-TAX-051,Die §§ 7-12 des KStG gelten für die inländische Verlusttochter im Inland sowie die EU-Verlusttochter. Die profitable Inlandstochter ist nicht unter den Bestimmungen dieser Abschnitte zu berücksichtigen.
CORP-TAX-052,"Ja, eine Beteiligungsgemeinschaft kann als Gruppenträger fungieren. Für die Mindestquoten der einzelnen Mitbeteiligten gibt es keine allgemeingültigen Mindestquotevorschriften in Österreich. Dies hängt von den spezifischen Gesetzesbestimmungen ab, insbesondere von den Bestimmungen des Finanzmarktaufsichtsgesetzes (FinMaG). Es ist daher ratsam, die spezifischen Vorschriften des jeweiligen Unternehmens oder der verwalteten Aktien zu beachten."
CORP-TAX-053,"Für die Steuerfreiheit inländischer Beteiligungserträge gibt es keine spezifischen Mindestbeteiligungsquoten oder Haltefristen in der österreichischen Steuerordnung. Die Steuerfreiheit hängt von den genauen Umständen ab, wie zum Beispiel der Art des Vermögens (Aktien, Anteile usw.), der Beteiligung und der Zeitpunkt der Erwerbung. Einzelheiten sind in den Steuergesetzen und -Verordnungen zu finden."
CORP-TAX-054,"Die 'Option zur Steuerwirksamkeit' ist eine rechtliche Möglichkeit, um eine Steuererklärung oder eine andere Steuererfassungsgrundlage zu aktualisieren. Sie kann ausgeübt werden, wenn der Steuerpflichtige feststellt, dass die bisherige Erklärung oder Grundlage nicht mehr korrekt ist. Die Ausübung erfolgt durch den Eingriff in die bereits bestehende Erklärung oder Grundlage und die Änderung der relevanten Angaben. Es handelt sich dabei um eine rechtlich bindende Maßnahme, die nach dem Steuergesetz von 2013 (StGB) vorgesehen ist."
CORP-TAX-055,"Die Sitzverlegung einer inländischen Tochtergesellschaft ins Ausland kann zu einem Verlust der stillen Reserven haben, wenn diese nicht als internationale Schachtelbeteiligung angesehen werden. In diesem Fall müssen die inländischen Stillen Reserven als internationale Beteiligungen behandelt werden, was die Steuerpflichten und -belastungen beeinflusst."
CORP-TAX-056,"(a) Wenn der Verkäufer konzernfremd ist, gelten die Zinsen als freibare Kosten im Sinne des § 19 Abs. 2 Satz 1 Buchstabe a EStG.

(b) Wenn der Verkäufer die Muttergesellschaft ist, gelten die Zinsen als nicht freibleitige Kosten im Sinse des § 19 Abs. 2 Satz 1 Buchstabe b EStG."
CORP-TAX-057,"Die Einschränkung für den Betriebsausgabenabzug bei nur teilweise steuerpflichtigen Körperschaften besteht darin, dass nur die Ausgaben, die für den Teil des Geschäftsbetriebes gelten, die in der Steuererklärung als steuerpflichtig gemeldet wurden, abgezogen werden können."
CORP-TAX-058,"Die Einschränkung betrifft den Betriebsausgabenabzug für eine Körperschaft, die nur teilweise steuerpflichtig ist, indem sie nur bestimmte Ausgaben als steuerliche Ausgaben abzuziehen hat, die direkt mit der steuerpflichtigen Tätigkeit zusammenhängen. Andere Ausgaben, die nicht direkt mit der steuerpflichtigen Tätigkeit verbunden sind, können nicht als steuerliche Ausgaben abgezogen werden."
CORP-TAX-059,"Ja, Strafen, die von Gerichten oder Verwaltungsbehörden verhängt werden, sind in der Regel steuerlich abzugsfähig, wenn sie als Buße oder Geldbuße angesehen werden. Diese Abzugsmöglichkeit hängt jedoch von den spezifischen Umständen ab, insbesondere von den rechtlichen Vorschriften des jeweiligen Steuervertrags und der gesetzlichen Regelungen zur Steuerabsetzung."
CORP-TAX-060,"Aufsichtsratsvergütungen sind in Deutschland als ""Mitgliedsprämien"" im Sinne des § 21a EStG (Einkommensteuergesetz) zu behandeln. Sie gelten als freie Einnahmen und sind daher nicht als Einkommen zu steuern. Dennoch können sie in bestimmten Fällen zur Berücksichtigung bei der Berechnung der Einkommensteuer beitragen. Es ist jedoch wichtig, dass diese Regelungen rechtlich umgesetzt und kontrolliert werden. In Österreich gibt es keine speziellen Regelungen, die Aufsichtsratsvergütungen im Detail regeln, sodass sie wahrscheinlich ähnlich wie in Deutschland behandelt werden."
TAX-INTL-001,"Nein, die Wiener Wohnung in Österreich würde grundsätzlich keine unbeschränkte Steuerpflicht begründen, da der Angestellte seinen Wohnsitz in Deutschland beibehält und seine Hauptwohnsitzeinrichtung dort bleibt. Der Wohnsitz als Hauptwohnsitz in Deutschland würde die Steuerpflicht in Deutschland bestätigen, während die Wiener Wohnung möglicherweise nur als Nebenwohnung oder als Arbeitsplatzort betrachtet werden könnte."
TAX-INTL-002,"Ja, der Investor ist in Österreich nur beschränkt steuerpflichtig."
TAX-INTL-003,"Nein, entsteht dadurch keine unbeschränkte Steuerpflicht. Der französische Consultant hat jedoch eine mögliche Steuerpflicht nach den EU-Steuergleichstellungsgesetzen (Umsatzsteuergesetz - UStG). Er muss sich gemäß den EU-Regelungen für EU-Bürger oder EU-Geschäftspartner registrieren und Steuern leisten."
TAX-INTL-004,"Nein, die Zweitwohnung führt nicht zu unbeschränkter Steuerpflicht allein. Die Anzahl der verbrachten Tage ist gering und sie bleibt überwiegend im Ausland. Es gibt jedoch andere Aspekte wie den Erwerbswert der Wohnung, die mögliche Nutzung und mögliche Einnahmen, die das Steuerrecht betrifft. Einzelne Fälligkeiten sollten von einem Steuerberater oder einem Steueranwalt beraten werden."
TAX-INTL-005,"Ja, der inländische Wohnsitz behält er dadurch grundsätzlich. Der inländische Wohnsitz wird im österreichischen Steuerrecht als ""Hauptwohnsitz"" bezeichnet und ist nicht durch den Wohnsitz eines der Familienmitglieder in einem anderen Land beeinflusst."
TAX-INTL-006,"Nein, eine leerstehende, unmöblierte Wohnung, die nicht bewohnt wird, kann keinen Wohnsitz bilden. Ein Wohnsitz erfordert tatsächliche Bewirtschaftung und Nutzung des Hauses."
TAX-INTL-007,"Nein, der inländische Wohnsitz kann nicht dadurch begründet werden, dass der Nutzer ausschließlich in einem mobilen Wohnwagen während seines Österreich-Aufenthaltes lebt. Ein inländischer Wohnsitz erfordert eine tatsächliche und regelmäßige Aufenthaltserklärung im Inland, was hier nicht gegeben ist."
TAX-INTL-008,"Ja, behält die Studentin grundsätzlich einen inländischen Wohnsitz. Eine Person behält ihren inländischen Wohnsitz, solange sie nicht regelmäßig und mit der Absicht, dort zu leben, eine andere Wohnung in einem anderen Land bezieht. Da die Studentin das Elternhaus in Graz nutzt, wenn sie nicht in den Niederlanden lebt, bleibt ihr ein inländischer Wohnsitz bestehen."
TAX-INTL-009,"Nein, der Arbeitnehmer kann dadurch keinen gewöhnlichen Aufenthalt in Österreich begründen. Ein gewöhnlicher Aufenthalt wird nach dem Steuergesetz definiert als eine regelmäßige Tätigkeit in Österreich, die nicht nur zeitweise oder sporadisch erfolgt. Der tägliche Wechsel zwischen Österreich und der Slowakei entspricht eher einer kurzen, nicht ständigen Tätigkeit."
TAX-INTL-010,"Nein, kann nicht. Ein gewöhnlicher Aufenthalt in Österreich erfordert eine regelmäßige oder kontinuierliche Tätigkeit im Inland, was hier nicht der Fall ist. Der Arbeitnehmer übernachtet nur am Werkort und fährt am Wochenende heim."
