id,answer
VAT-INTL-032,"Nein, das ist keine Katalogleistung nach Umsatzsteuerrecht. Eine Katalogleistung bezieht sich auf den Verkauf von Produkten oder Dienstleistungen, die in einem Verzeichnis oder Preisliste angegeben sind. In diesem Fall handelt es sich um eine einmalige Dienstleistung ohne spezifische Preisliste."
VAT-INTL-033,Der Leistungsort liegt in Wien.
VAT-INTL-034,Der Leistungsort ist in der Schweiz.
VAT-INTL-035,"Der Bundesminister für Finanzen verfolgt mit der Anwendung des § 3a Abs. 16 UStG vor allem den Zweck, die Steuererklärung von Unternehmen zu vereinfachen und zu erleichtern, indem er die Möglichkeit schafft, bestimmte Steuerbelastungen in einem Jahr einzuschränken. Dies trägt zur Effizienz der Steuerverwaltung bei und fördert gleichzeitig die Wirtschaftlichkeit für die betroffenen Unternehmen."
VAT-INTL-036,Der Leistungsort nach § 3a Abs. 16 UStG kann sich durch eine Verordnung in Richtung des Ortes des Erwerbers oder des Nutzers verschieben.
VAT-INTL-037,"Dieser Vorgang ist umsatzsteuerlich als Verkauf von Rohstoffen (Getreide) zu Rohstoffen (Mehl) einzustufen, da der Müller das Mehl nicht selbst hergestellt hat. Der Landwirt erkennt hierbei einen Ertrag und trägt daher Umsatzsteuer."
VAT-INTL-038,Der Steuersatz 20 % gilt für die Weiterverrechnung der Stadtführungsermächtigung vom Reisebüro an die Reisegruppe.
VAT-INTL-039,Ort der Leistung: Wien
VAT-INTL-040,"In Österreich ist die Leistung der Pflegekraft steuerpflichtig, wenn sie im Sinne des § 13a EStG (Erwerbsleistungen) gewertet wird. Da die Pflegearbeit in Serbien nicht in Österreich registriert wurde, ist sie nicht als Erwerbsleistung in Österreich erfasst. Daher ist diese Leistung in diesem Fall nicht steuerpflichtig in Österreich."
VAT-INTL-041,Der Leistungsort liegt in Österreich.
VAT-INTL-042,"Nein, das ist keine sonstige Leistung. Es handelt sich um eine Pflichtleistung, da Herr Stolz verpflichtet war, seine Angestellten entsprechend der Arbeitsverhältnisse zu unterstützen."
VAT-INTL-043,"Nein, das ist nicht eine sonstige Leistung, sondern eine Übernachtung im Eigentum des Unternehmens. Dies könnte Steuerfolgen haben, insbesondere wenn es sich um einen Vorverdienst handelt."
VAT-INTL-044,"Ja, Herr Müller muss etwas steuerlich versteuen, da der Firmenwagen nun als Privatfahrzeug eingesetzt wird."
VAT-INTL-045,"Ja, die Personengemeinschaft muss etwas steuerlich versteuern, da das Firmenfahrrad nicht mehr ausschließlich zur Geschäftsbedeutung verwendet wurde."
VAT-INTL-046,Wien
VAT-INTL-047,"In diesem Fall gilt die Leistung steuerlich als ausgeführt in Linz. Die Buchhaltung für die Filiale in Linz wird von einem Buchhaltungsunternehmen aus Wien durchgeführt, was bedeutet, dass die Leistung im rechtlichen Sinne an der Filiale in Linz stattgefunden hat."
VAT-INTL-048,"Gilt der Leistungsort der Leistung im Ort des Auftrags, also in Graz."
VAT-INTL-049,Graz
VAT-INTL-050,"Eine Vermittlungsleistung an einen Nichtunternehmer wird an dem Ort anerkannt, wo der Vermittler seine Sitz oder Sitz und Grundstücksfläche hat."
VAT-INTL-051,"Die Maklerleistung gilt nicht als eine andere Leistung im Zusammenhang mit dem Grundstück, sondern als spezielle Vermittlungsleistung. Sie wird in der Regel in der Vermittlungsstätte oder im Büro des Maklers ausgeführt."
VAT-INTL-052,Der Leistungsort liegt auf dem Campingplatz.
VAT-INTL-053,"Ja, das ist eine sonstige Leistung im Zusammenhang mit dem Grundstück. Die Leistung wird als erbracht, wenn Frau Meier den Entzug des Gebrauchs des Grundstücks beantragt oder der Vertrag, in dem das Entgelt festgelegt ist, abläuft."
VAT-INTL-054,"Eine Führung in einem Museum und der Verkauf eines Kunstwerks in einer Galerie sind beide als Leistungen der ersten Kategorie (Leistungen im Bereich des Handels) gesehen. Sie gelten nicht als ""sonstige Leistung""."
VAT-INTL-055,"Für Lagerungs- oder Umschlagsleistungen, die üblicherweise mit Transport verbunden sind, bei einem Nichtunternehmer gelten Regelungen des Finanzmarktaufsichtsgesetzes (FMAG). Es handelt sich hierbei um Nebenleistungen, die in der Regel nicht separat steuerpflichtig sind, wenn sie mit dem wesentlichen Transport zusammenhängen."
VAT-INTL-056,"Reparaturarbeiten oder Gutachten an beweglichen Gegenständen zählen als sonstige Leistung, wenn sie nicht zur Erhaltung oder Nutzung des Gegenstands unbedingt erforderlich sind. Es handelt sich dann um eine Kostenstruktur, die normalerweise von dem Nutzer selbst tragen würde, und nicht als Pflichtleistung eines Unternehmens oder Dienstleisters angesehen wird."
VAT-INTL-057,"Die Restaurant- oder Cateringleistung an einem Standort, an dem der Unternehmer nicht registriert ist, kann in diesem Fall möglicherweise als Standortübertretung angesehen werden, was möglicherweise zu Steuerfolgen führen kann. Es ist ratsam, den jeweiligen Steuerbehörden um Beratung zu fragen, da dies rechtlich komplex sein kann."
VAT-INTL-058,"Die Leistung ist steuerlich als ausgeführt zu betrachten, wo die Messe stattfindet, also in München."
VAT-INTL-059,Die Vermietung des Motorboots in Hamburg gilt steuerlich als ausgeführt im Standort Österreich.
VAT-INTL-060,"Ja, handelt es sich bei der Vermietung eines Motorboots für 2 Wochen in Hamburg um eine kurze Vermietung. Normalerweise wird eine Vermietung als kurzfristig betrachtet, wenn sie weniger als 3 Monate dauert."
VAT-INTL-061,München
VAT-INTL-062,"Ja, handelt es sich bei der Vermietung eines PKWs für 25 Tage in München um eine kurzefristige Vermietung. Eine kurzefristige Vermietung wird in Österreich als Vermietung mit einer Dauer von weniger als 90 Tagen definiert."
VAT-INTL-063,In Wien ist die Leistung steuerpflichtig.
VAT-INTL-064,"Die Leistung des Software-Developers in Österreich ist steuerpflichtig, da der Entwickler in Österreich tätig war und den Dienst an einen Inhaber eines österreichischen Unternehmens (Japan) bereitstellte."
VAT-INTL-065,Die Leistung ist in Deutschland steuerpflichtig.
VAT-INTL-066,Der Leistungsort ist in Bern.
VAT-INTL-067,Der Leistungsort liegt in Österreich.
VAT-INTL-068,"In Österreich ist die Leistung steuerpflichtig, da der Würstelstand als österreichische Gewerbeunternehmung gemäß § 9 Absatz 1 Satz 2 EStG (Österreichs Einkommensteuergesetz) in der Lage ist, eine Einnahme zu erzielen, unabhängig davon, wo die Leistung geleistet wird. Da die Touristen aus Frankreich nicht als österreichische Steuerzahler gelten, ist die Einnahme nicht im Sinne der österreichischen Steuerordnung steuerpflichtig."
VAT-INTL-069,"Die Leistung ist in Österreich steuerpflichtig, da der Tourist als Erwerb von Unterkunft und Verpflegung anzusehen ist. Dies gilt unabhängig vom Standort des Hotels."
VAT-INTL-070,In Mailand ist die Leistung steuerpflichtig.
VAT-INTL-071,"Die Leistung (die Eintrittskarten) ist in Deutschland steuerpflichtig, da das Unternehmen, das die Ausstellung organisiert, ansässig in Deutschland ist."
VAT-INTL-072,In Frankreich.
VAT-INTL-073,"Die Leistung ist in Österreich steuerpflichtig, da Christian als österreichischer Steuerpflichtiger gemäß der österreichischen Steuergesetzgebung auch für die Erhebung von Steuern für seine Bed & Breakfast-Leistung verantwortlich ist, unabhängig von seiner Staatsbürgerschaft."
VAT-INTL-074,Die Leistung ist in Frankreich steuerpflichtig.
VAT-INTL-075,Die Leistung ist in den USA steuerpflichtig.
VAT-INTL-076,Die Leistung ist in Griechenland steuerpflichtig.
VAT-INTL-077,Griechenland
VAT-INTL-078,"Die Leistung ist in Österreich steuerpflichtig, da der Mietvertrag zwischen dem Touristen aus Deutschland und dem österreichischen Bauernhof einen tatsächlichen Nutzen für den Betreiber des Tiny Houses erzeugt. Dies gilt unabhängig davon, ob das Tiny House als eigenständige Unterkunft oder als Teil eines Bauernhofs genutzt wird."
VAT-INTL-079,Die Leistung ist in Österreich steuerpflichtig.
VAT-INTL-080,Die Leistung ist in Deutschland steuerpflichtig.
VAT-INTL-081,"Die Leistung ist in Österreich steuerpflichtig, da das Start-up als österreichischer Unternehmer im Sinne des Steuergutschaftsgesetzes (StG) als Repräsentant der Leistung anzusehen ist."
VAT-INTL-082,"In Österreich ist die Leistung steuerpflichtig, da das Unternehmen als österreichische Rechtsnachfolger verantwortlich ist."
ESTG27-001,"Die beiden Ausschüttungen sind unterschiedlich einzubeziehen:

1. Die 10.000 Euro aus der GmbH im Einzelvermögen sind als Einkommen des Einzelvermögens einzubeziehen.

2. Die 2.000 Euro Dividende aus den privaten Aktien sind als Einkommen des Privatvermögens einzubeziehen."
ESTG27-002,"Ja, der Unterschiedsbetrag von 15.000 Euro ist steuerpflichtig."
ESTG27-003,"Der steuerpflichtige Gesamtertrag beträgt 4.800 €. Die betroffenen Tatbestände sind das Erwerb von Wertpapieren und die Veräußerung sowie die Zuweisung von Dividenden. Der Erwerb von Wertpapieren wird im Sinne von § 27 Abs. 1 Nr. 1 EStG berücksichtigt, da es sich um Aktien handelt. Die Zuweisung von Dividenden wird im Sinne von § 27 Abs. 1 Nr. 2 EStG berücksichtigt, da es sich um eine Dividende handelt. Die Veräußerung erfolgt im Sinne von § 27 Abs. 1 Nr. 3 EStG."
ESTG27-004,"Der Verlust aus Jahr 1 kann nicht direkt mit den Dividenden aus Aktien in Jahr 2 verrechnet werden. Der Verlust muss zunächst in das Steuerjahr 2 berücksichtigt werden, da es sich um einen Verlustanteil handelt. Nach dem Berücksichtigung des Verlustes in Jahr 2 können die Dividenden aus Aktien in Jahr 2 als Gewinn ausgewertet werden."
ESTG27-005,"Nein, die Übertragung der Aktien gilt nicht als Veräußerung. Die Aktien wurden lediglich von einem Depot in Österreich an ein anderes Depot in Deutschland übertragen. Der Wert der Aktien wurde nicht verändert, sondern es änderte sich lediglich der Standort des Depots. Daher bleiben die Anschaffungskosten bei den 5.000 Euro bestehen."
ESTG27-006,"Die Rückübertragung erfolgt ohne Steuerschuld nach § 13 Absatz 1 Satz 2 SteuG. Der Erwerb des Vermögens durch die Privatstiftung ist als Erwerbszeitpunkt zu beachten. Da die Rückübertragung im Laufe der Jahre erfolgt, ist die Rückübertragung in den Jahren der Rückübertragung zu berücksichtigen. Die Rückübertragung von 80.000 Euro ist ohne Steuerschuld zu behandeln."
ESTG27-007,Die gezahlten 200 Euro Stückzinsen beim Kauf der Anleihe und die erhaltenen 350 Euro Stückzinsen beim Verkauf der Anleihe nach § 27 EStG 1988 werden als Gewinnsteuerbelastbare Ertragsteuerung behandelt.
ESTG27-008,"Der Wegzug nach § 27 EStG 1988 führt zu einer Erhöhung des Steuernachweises für den jährlichen Steuerzahlerstand. Für die Aktien mit stillen Reserven beträgt der Steuernachweis 20.000 Euro, für den Future-Kontrakt mit latentem Gewinn 5.000 Euro. Somit beträgt der Gesamtnachweis 25.000 Euro. Der Wegzug nach § 27 EStG 1988 führt daher zu einer Steuererhöhung für Herrn Gruber."
ESTG27-009,"Ja, die Gewinne aus der Aktienveräußerung fallen nach § 27 EStG 1988 als Einkünfte aus Kapitalvermögen für den Kommanditisten der GmbH & Co KG an."
ESTG27-010,Beide Positionen müssen nach § 27 EStG 1988 als Gewinne oder Verluste behandelt werden. Die 800 Euro für die Put-Option und die 1.500 Euro für die Option als Stillhalterin sind als Verluste zu erfassen.
ESTG27-011,15.000 Euro
ESTG27-012,"Nein, gilt die ursprüngliche Depotübertragung nicht rückwirkend als Veräußerung. Die Übertragung erfolgte im Rahmen einer Wirtschaftsstrategie zur Reduzierung von Steuern und nicht als Tätigkeit zur Erwerbsentschädigung oder Veräußerung. Die Tatsache, dass Frau Koch nach Kanada zog, ändert nicht den Charakter der Transaktion."
ESTG27-013,"Nein, die beiden Zahlungen handelt es sich nicht um steuerpflichtige Einkünfte aus Kapitalvermögen nach § 27 EStG 1988, auch wenn jede Einzelzahlung unter 4.000 Euro liegt. Die Vorauszahlungen in der Agrargemeinschaft sind als Ertragsteuerbelastbare Einnahmen zu betrachten, da sie aus dem Kapitalvermögen stammen."
ESTG27-014,"Die Darlehenszinsen können nicht steuermindernd geltend gemacht werden. Der Veräußerungsverlust kann steuermindernd geltend gemacht werden, jedoch nur bis zu einem Betrag von 1.000 Euro pro Jahr."
ESTG27-017,"(1) Der laufende Ertrag von 1.000 Euro wird als regelmäßiger Betrag nach § 27 Abs. 1 Nr. 1 EStG behandelt.

(2) Die Sonderzahlung der AG anlässlich einer Kapitalerhöhung von 500 Euro wird als einmaliger Betrag nach § 27 Abs. 1 Nr. 2 EStG betrachtet.

(3) Der Betrag von 300 Euro, den die AG als übernommene Kapitalertragsteuer weiterleitet, wird als steuerliche Aussetzung nach § 27 Abs. 1 Nr. 3 EStG angesehen."
ESTG27-018,"Die Verlustausgleichssituation nach § 27 EStG 1988 ergibt sich wie folgt:

- Der Verlust von 3.000 Euro beim Verkauf der Aktien im März kann nicht ausgleicht werden, da er in einem anderen Jahr als den Käufen im Januar und dem Kauf der Anteile im April entstanden ist.

- Der CFD-Verlust von 1.200 Euro kann ebenfalls nicht ausgleicht werden, da er in einem anderen Jahr als den Käufen und dem Kauf der Anteile entstanden ist.

- Die Erträge von 400 Euro aus dem Investmentfonds im Dezember können als Ertragserhöhung angesehen werden und sind daher nicht als Verlust ausgleichbar.

Es bleibt also kein ausgleichbarer Verlust nach § 27 EStG 1988."
ESTG27-019,"Die steuerlichen Konsequenzen betreffen die Möglichkeit der Wegzugsteuer nicht, da sie nur in Fällen der Veräußerung der Aktien gilt. Nach dem Wiedereintritt in das österreichische Besteuerungsrecht wird die Gewinnsteuer auf den Wertgewinn der Aktien berechnet, da diese im Ausland erzielt wurden."
ESTG27-020,"Ja, der Unterschiedsbetrag von 8.000 Euro ist steuerpflichtig."
ESTG27-021,"Ja, handelt es sich bei der Rückzahlung um Einkünfte aus Kapitalvermögen nach § 27 EStG 1988."
ESTG27-022,"Der Tauschvorgang nach § 27 EStG 1988 wird als ""Tausch von Vermögensgegenständen"" behandelt, bei dem sich die Anteile an der X-GmbH gegen Anteile an der Y-GmbH austauschen lassen. Da es sich um einen nicht unter das Umgründungssteuergesetz fallenden Tausch handelt, gelten hier die allgemeinen Regelungen des § 27 EStG 1988. Es ist zu beachten, dass die Anschaffungskosten von 8.000 Euro den Beginn der Erhaltungsklausel bezeichnen, während der gemeine Wert von 15.000 Euro den Beginn der Erwerbsklausel bezeichnet. Der Tauschvorgang selbst wird ohne zusätzliche Steuerbelastung angesehen, da er nicht unter das Umgründungssteuergesetz fällt."
ESTG27-023,"Die Zuwendung von 20.000 Euro ist als Ausgabe der Bilanzswerte der Stiftung zu behandeln, da das Evidenzkonto einen Stand von 5.000 Euro hat und der maßgebliche Wert 12.000 Euro beträgt. Daher wird die Steuerbasis für die Zuwendung auf den Bilanzgewinn von 7.000 Euro festgelegt."
ESTG27-024,"Ja, liegen hierbei steuerpflichtige Tatbestände nach § 27 EStG 1988 vor. Die Veräußerung von Dividendenscheinen ohne die zugrunde liegenden Aktien stellt eine Umwandlung von Kapitalertragssteuerbelasteten Einkommen in Steuerfreiheit dar, was im Rahmen des § 27 EStG 1988 als Steuerpflichtigkeit erkannt wird."
ESTG27-025,"Herr Kohl muss 3.000 Euro Steuernzahlung antragen, da die Liquidationsquote über den Anschaffungskostenwert hinausgeht."
ESTG27-026,"Ja, der Unterschiedsbetrag von 12.000 Euro ist nach § 27 EStG 1988 steuerpflichtig."
ESTG27-027,"Nein, die Übertragung der Unternehmensanleihen in das Betriebsvermögen der neuen GmbH gilt nicht als Veräußerung nach den Bestimmungen des Umgründungssteuergesetzes (UmgrStG). Die Umgründung ist hierbei eher als eine Umstrukturierung des Unternehmens betrachtet, die nicht automatisch zur Veräußerung von Vermögensmitteln führt."
ESTG27-028,"Die Zuwendung nach § 27 EStG 1988 wird als Vermögenszuwendung betrachtet, da es sich um eine Immobilie handelt. Die Anschaffungskosten in der Stiftung (200.000 Euro) werden als Erhaltungskosten gezählt, was die Erhaltung des Vermögens anzeigt. Die Hypothek (80.000 Euro) reduziert den Wert der Vermögenszuwendung auf 200.000 Euro. Daher ist die Vermögenszuwendung im Sinne von § 27 EStG 1988 mit 200.000 Euro zu beurteilen."
ESTG27-029,"Die Positionen nach § 27 EStG 1988 sind als Vermögenserträge zu qualifizieren. Der Ausgleichsbetrag von 1.200 Euro am Jahresende ist eine Erklärung der unterschiedlichen Zinszahlungen in den beiden Jahren und wird als Teil des Vertragsgutsbetrages betrachtet. Der Swap-Vertrag selbst ist ein Vermögensertrag nach § 27 EStG 1988, da er sich auf das Privatvermögen bezieht und nicht auf eine Unternehmensstruktur."
ESTG27-030,"Nein, der bereits versteuerte ausschüttungsgleiche Ertrag kann nicht berücksichtigt werden. Der Veräußerungsgewinn wird nach dem Gesetz ohne Berücksichtigung von bereits versteuerten Erträgen berechnet."
ESTG27-031,Die Einkunftsart nach § 27 EStG 1988 vorliegt als Ausschüttung.
ESTG27-032,"Die Ausschüttung von 6.000 Euro ist unter § 27 EStG 1988 zu qualifizieren, da die FlexKapG erst seit 2024 existiert. Für Ausschüttungen aus FlexKapGs, die nach dem Inkrafttreten des Finanzmarktaufsichtsgesetzes (FMA-G) im Jahr 2020 entstehen, gelten die neuen Regelungen. Da die FlexKapG erst seit 2024 existiert, gilt die neue Interpretation, wonach solche Ausschüttungen als Gewinnsteuerbelastbare sind. Daher ist die Ausschüttung unter § 27 EStG 1988 zu qualifizieren."
ESTG27-033,"Die Ausgleichszahlung und die Leihgebühr sind als Gewinne zu steuern. Der Veräußerungsverlust kann nicht ausgleichsweise verwendet werden, da er nicht direkt durch den Wertpapierleihvertrag entstanden ist."
ESTG27-034,"Die Überführung der Futures nach dem USA führt zu einer Festsetzung der Wegzugsteuer gemäß § 27 EStG 1988, da das Depot in einem Nicht-EU-Staat liegt."
ESTG27-035,"Der Verlust in Höhe von 12.000 Euro wird vollständig als Verlust der Einlage gezählt. Da die Verlustbeteiligung auf die Höhe der Einlage beschränkt ist, kann Herr Falk nicht mehr als 10.000 Euro Verluste verzeichnen. Der überschüssige Verlust von 2.000 Euro muss in das nächste Geschäftsjahr übertragen werden."
ESTG27-036,"Nein, diese Vorgänge lösen nach § 27 EStG 1988 keine steuerlichen Konsequenzen aus. Der § 27 EStG 1988 betrifft den Transfer von Vermögenswerten zwischen verschiedenen Bankdepots innerhalb eines einzigen Haushalts oder einer einzigen juristischen Person, was hier nicht der Fall ist. In beiden Fällen handelt es sich um einen Transfer zwischen zwei unterschiedlichen Banken, wodurch keine Steuerfolgen nach § 27 entstehen."
ESTG27-037,"Ja, die übernommene Kapitalertragsteuer (KESt) ist für Herrn Rau steuerlich relevant. Sie muss als erklärter Einkommensteuerbelastung berücksichtigt werden, da sie von der Privatstiftung für ihn übernommen wurde."
ESTG27-038,"Nein, Frau Eich hat recht nicht. Die Ausschüttung an Frau Eich ist als Gewinn der GmbH zu betrachten, da sie nicht aus dem privaten Kapitalvermögen stammt. Sie wird daher als Einkommen nach § 27 EStG 1988 gewertet."
ESTG27-039,"Der Tausch von Bitcoin gegen Ethereum sowie die Veräußerung von Ethereum zu Geld führt zu Steuerfolgen gemäß § 27 EStG 1988. Der Tausch von Bitcoin gegen Ethereum ist ohne Steuerbelastung, da es sich um einen Werttusch innerhalb eines privaten Vermögensbereichs handelt. Die Veräußerung des Ethereum zu Geld erfordert jedoch eine Steuerabgabe gemäß § 27 Absatz 1 Buchstabe a EStG. Der Steuerbetrag entspricht dem Gewinn (28.000 - 25.000 = 3.000 Euro) minus eventuelle Steuerhilfen."
ESTG27-040,"Nein, kann sie nicht. Die Zuwendung muss erst nach Bestätigung des Vorjahresabschlusses bestätigt werden, um als Substanzauszahlung zu gelten."
EMP-001,"Ja, für die Privatnutzung des Luxusautos muss Lohnsteuer abgeführt werden, da das Fahrzeug als persönliches Eigentum angesehen wird und nicht als Werkzeug für die Arbeit. Der Arbeitgeber kann daher als Steuermittlungspartner die entsprechenden Steuerleistungen verlangen."
EMP-002,"Ja, solche einmaligen Entschädigungen sind im Regelsteuerrecht als steuerpflichtiges Arbeitseinkommen zu betrachten, da sie aus der Arbeitsbeziehung resultieren."
EMP-003,"Nein, die Mitarbeiterin muss für den Vorteil des Elektrofahrrades keinen Sachbezug versteuern."
EMP-004,"Ja, in diesem Fall handelt es sich um ein steuerpflichtiges Arbeitseinkommen. Der Koch erhält als Dienstleistung kostenloses Essen und ein Zimmer, was als Arbeitsleistung zu betrachten ist. Dies gilt auch, wenn der Koch ohnehin vor Ort sein muss. Der Betrieb des Hotels nutzt den Kochs Arbeitsleistung, daher ist das Gehalt steuerpflichtig."
EMP-005,"Ja, solche Bezüge sind in der Regel steuerpflichtig, auch wenn der Mitarbeiter zum Zeitpunkt der Auszahlung nicht mehr am Arbeitsplatz steht. Das betrifft sowohl die freie als auch die abgerechnete Abgangsentschädigung. Der Steuerzahler hat das Recht, diese Summe zu steuern, da sie als Entgelt für seine Arbeit angesehen wird."
EMP-006,"Nein, der Angestellte muss die übernommenen Studiengebühren als Sachbezug nicht versteuern. Dies gilt insbesondere, wenn die Kosten für das Masterstudium direkt mit der beruflichen Entwicklung des Angestellten in Zusammenhang stehen."
EMP-007,"Ja, der Außendienstmitarbeiter muss den Betrag von 26,40 € pro Tag in seiner Steuererklärung als Einkommen versteuern. Dies gilt insbesondere, wenn die Taggelder als Gehalt oder als Teil des Gehalts betrachtet werden."
EMP-008,"Nein, der Beitrag des Arbeitgebers in die freiwillige Pensionskasse ist nicht unmittelbar als Lohn zu versteuern. Dieser Beitrag wird als Spende angesehen und trägt zur Gesamtleistung des Arbeitgebers bei, die im Sinne der Steuerordnung als Gewinneinlage bezeichnet werden kann. Der Mitarbeiter muss jedoch den Beitrag als Ausgaben für Lebensversicherungen oder ähnliche Zwecke berücksichtigen."
EMP-009,"Nein, der Mitarbeiter muss diesen Vorteil nicht als Gehaltsteil versteuern. Dieser Umzugskostenbeitrag ist eine Arbeitskostenauslagenleistung und nicht Teil des Gehalts. Er wird im Rahmen der Arbeitnehmerkosten nicht als Einkommensteuerbelastung behandelt."
EMP-010,"Nein, die Zahlung ist nicht steuerfrei. Sie wird als Einkommen der Mitarbeiterin gezählt, was zu Steuern führen kann."
EMP-011,"Ja, der Arbeitnehmer muss diese Entschädigung steuerlich versteuern, da sie als freistehende Leistung angesehen wird und nicht als Teil des Arbeitslohns betrachtet wird."
EMP-012,"Nein, der Wert der Uniformen, die als Teil des Arbeitslebens bereitgestellt wird, ist nicht ein steuerpflichtiges Einkommen für die Mitarbeiter. Es handelt sich hierbei um eine Arbeitsmittel, die im Rahmen des Arbeitsverhältnisses bereitgestellt wird."
EMP-013,"Ja, solche Vermittlungsprovisionsgelder fallen unter die Einkünfte aus nichtselbständiger Arbeit."
EMP-014,"Ja, die monatliche Pauschale für die Abnutzung des eigenen Werkzeuges ist in der Regel lohnsteuerpflichtig."
EMP-015,"Nein, die Klimaticket-Karte muss nicht als Sachbezug versteuert werden. Sie dient lediglich der Bequemlichkeit des Angestellten und ist kein wirtschaftlicher Wert für den Arbeitgeber."
EMP-016,"Ja, handelt es sich bei den nicht verbrauchten Urlaubstage im Rahmen der Beendigung eines Arbeitsverhältnisses um Arbeitseinkommen im Sinse des Gesetzes."
EMP-017,"Ja, der Mitarbeiter muss diese 300 € versteuern, da es sich um eine steuerliche Ertragsgewinnquelle handelt."
EMP-018,"Ja, die Alterspension fallen unter § 25 EStG, da sie als Arbeitseinkommen betrachtet wird, auch wenn der Arbeitnehmer nicht mehr aktiv beschäftigt ist."
EMP-019,"Nein, der IT-Techniker muss für den privaten Nutzungsvorteil des Notebooks nach § 25 nicht einen Sachbezug steuernd versteuern. Der Nutzen des Vorstandsprivilegiums (§ 25) gilt nur für den Arbeitsbedarf und nicht für private Nutzung."
EMP-020,"Ja, der Fixbetrag von 30 € pro Monat wird als Teil ihres steuerpflichtigen Gehalts gewertet. Er ist zu den anderen Einnahmen der Kassiererin gezählt und trägt zur Berechnung ihres Einkommenssteuersatzes bei."
EMP-021,"Ja, Pensionszusagen zählen zu den Einkünften aus nichtselbständiger Arbeit und müssen daher bei der Berechnung des Steuerbetrags berücksichtigt werden."
EMP-022,"Ja, solche Zahlungen können als Einkünfte aus nichtselbständiger Arbeit gelten, wenn sie im Zusammenhang mit einem Unfall sind, der durch den Arbeitnehmer verursacht wurde. Dies hängt jedoch von den genauen Umständen ab und kann steuerrechtliche Beratung erfordern."
EMP-023,"Ja, Krankengeld zählt im Rahmen der Steuergesetzgebung in Österreich zu dem Begriff ""Arbeitslohn"". Es wird daher bei der Berechnung des Stegutsatzes und anderer Steuerfaktoren berücksichtigt."
EMP-024,"Nein, diese Zahlungen aus dem Unterstützungssystem der Rechtsanwaltskammer zählen nicht als Arbeitslohn im Sinne des Steuergesetzes. Sie dienen der Unterstützung des Angehörigen oder des Arbeitnehmers in Zeiten der Not und sind von der Steuerbehörde oft als Sonderzahlungen betrachtet."
EMP-025,"Zahlungen aus einer Versorgungs- oder Unterstützungseinrichtung gelten als Arbeitslohn, wenn sie dem Unternehmer regelmäßig und kontinuierlich gezahlt werden und er in der Einrichtung tätig ist. Es kommt darauf an, ob die Einrichtung als Arbeitgeber gilt und die Zahlungen als Arbeitslohn eingestuft werden können. Dies hängt von den spezifischen Umständen ab, wie z.B. der Art der Tätigkeit des Unternehmers und der rechtlichen Struktur der Einrichtung."
EMP-026,"Ja, solche Zahlungen sind in der Regel voll steuerpflichtig. Sie gelten als Einkommen des Arbeitnehmers und werden entsprechend der Steuergesetzgebung in Österreich mit Steuer gemäß den aktuellen Steuerbestimmungen abgezogen."
EMP-027,"Die Auszahlungen aus der Pensionskasse der Firma werden als Einkommen des Geschäftsführers steuerpflichtig gemäß § 23 Absatz 1 Satz 1 Buchstabe a EStG (Erwerbsverhältnis). Da er 15 % der Firmenanteile besitzt, ist er im Erwerbsverhältnis tätig. Die Auszahlungen sind daher als Einkommen zu steuern."
