id,answer
GRESt-AT-001,"Nein, der Erwerb der Anteile zur Holding führt nicht zu Grunderwerbsteuer für das Grundstück der Tochter-GmbH aus. Die Grunderwerbsteuer richtet sich gegen den Erwerber des Grundstücks, also die Tochter-GmbH in diesem Fall. Da die operative GmbH nur 85% der Anteile an der Tochter-GmbH besitzt, ist sie kein direkter Erwerber des Grundstücks und somit nicht verpflichtet, Grunderwerbsteuer zu zahlen."
GRESt-AT-002,"Ja, durch die Bestandsänderung entsteht eine Steuerpflicht. Die Veränderung der Gesellschafter führt zu einem Erwerbserlös, der steuerlich berücksichtigt werden muss."
GRESt-AT-003,Am bereinigten Kapital.
GRESt-AT-004,"Die Grunderwerbsteuer für die Produktionsmaschinen wird nach dem Gesetz als Teil des gesamten Gebäudes abgezogen und nicht separat erhoben. Daher ist es nicht möglich, die Maschinen separat zu steuern."
GRESt-AT-005,"Nein, dieser Erwerb ist nicht von der Grunderwerbsteuer befreit. Der Erwerb von Grundstücken mit einer geplanten Wohnnutzfläche von über 140 m² wird in Österreich von der Grunderwerbsteuer belastet."
GRESt-AT-006,"Ja, für den Erwerb des immensen Eigentumsanteils durch die eingetragene Partnerin nach dem Tod des Mannes fällt Grunderwerbsteuer an."
GRESt-AT-007,"Nein, falls die beiden Miteigentümer das Grundstück physisch in zwei gleich große Teile teilen und jeder Teilstück einen Wert von genau 50% des Gesamtwertes hat, fällt hierfür keine Steuer. Dies ist eine rein rechtliche und nicht wirtschaftliche Umwandlung, die keine Steuerfolge nach § 14 Abs. 2 EStG (Einkommensteuergesetz) hat."
GRESt-AT-008,Der Betrag von 1.000 Euro bleibt steuerfrei. Die Tochter muss mindestens 6 jährige Erwerbsfähigkeit nach dem Übertragungsdatum aufweisen.
GRESt-AT-009,"Der Grundstückswert tritt an die Stelle des Kaufpreises als Bemessungsgrundlage bei einem Erwerbsvorgang, wenn der Kaufpreis über 50.000 Euro beträgt."
GRESt-AT-010,"Die Steuer wird nach den Steuergesetzen gemäß § 21 Abs. 1 EStG berechnet, da es sich um eine Vermögensveränderung handelt. Der Kauf des Grundstücks führt zur Erteilung eines Steuererlasses, der die Steuerbasis definiert. In diesem Fall könnte die Steuer aufgrund des Bauherrenmodells in Höhe von 0% berechnet werden, da das Grundstück als Eigentum des Kaufers angesehen wird und keine direkte Nutzung durch den Verkäufer besteht."
GRESt-AT-011,"Ja, die von dem Verkäufer auf das Haus stehende Hypothek gehört zur Bemessungsgrundlage der Immobiliensteuer des Kauflandes."
GRESt-AT-012,Der Steuersatz für den Erwerb eines Grundstücks in einem Familienverband betrifft Grundstückswerte über 450.000 Euro. Der Steuersatz beträgt 3 %.
GRESt-AT-013,Der Steuersatz 22% kommt zur Anwendung.
GRESt-AT-014,Die Steuerschuld entsteht bei einem gewöhnlichen Kaufvertrag über eine Immobilie am Tag der vollstreckbaren Vertragsabschlussurkunde.
GRESt-AT-015,Der Verkäufer ist gegenüber dem Finanzamt für die Zahlung der Grunderwerbsteuer verantwortlich.
GRESt-AT-016,"Nein, die bereits gezahlte Grunderwerbsteuer kann nicht zurückgefordert werden. Das Erhöhen oder Verlängern des Kaufvertrags nach dem Kauf ohne rechtliche Grundlage führt zu einer automatischen Rückzahlung der Grunderwerbsteuer gemäß § 11a UStG."
GRESt-AT-017,Der steuerpflichtige Erwerbsvorgang muss dem Finanzamt innerhalb von 30 Tagen nach dem Enddatum des Erwerbsvorgangs angezeigt werden.
GRESt-AT-018,Die Bemessungsgrundlage für die Grunderwerbsteuer bei der Erwerbung eines Grundstücks durch Zwangsversteigerung entspricht dem Kaufpreis des Grundstücks.
GRESt-AT-019,Die Grunderwerbsteuer beträgt 7.000 Euro.
GRESt-AT-020,"Die Grunderwerbsteuer für die Einräumung des Baurechtes berechnet sich nach § 31a UStG auf den Wert der Einräumung, also auf den monatlichen Bauzinssatz."
GRESt-AT-021,"Ja, die Abtretung der Rechte aus einem verbindlichen Kaufanbot für ein Grundstück gilt im Allgemeinen unter der Grunderwerbsteuer."
GRESt-AT-022,"Nein, der Aktienkauf löst nicht automatisch Grunderwerbsteuer für die Grundstücke der AG aus. Die Grunderwerbsteuer richtet sich an den Eigentümer der Grundstücke, also die AG in diesem Fall. Der Investor muss die Grunderwerbsteuer bezahlen, wenn er die Aktien verkauft oder sie als Geschenk erhält."
GRESt-AT-023,Für die Beurteilung der grupperwerbsteuerpflichtigen Anteilsvereinigung werden die Anteile dem Treugeber zurechnet.
GRESt-AT-024,"Nein, das Gebäude wird nicht grunderwerbsteuerlich als Grundstück behandelt. Es wird als Vermietungsinvestition gelten und entsprechend der Vermietungssteuer gemäß § 13a UStG belastet."
GRESt-AT-025,"Nein, der Kauf eines kleinen ungenutzten Landstücks für 900 Euro fällt nicht unter den Fallbereich der Grunderwerbsteuer. Die Grunderwerbsteuer gilt nur für Grundstücke, die als Eigentum des Erwerbers bestehen bleiben und in der Lage sind, einen Wert zu erzielen. Ein kleines Stück ungenutztes Land ohne weitere Anlagen oder Wertpotential entspricht nicht diesen Kriterien."
GRESt-AT-026,Der Übergeber muss mindestens 65 Jahre alt und gesund sein.
GRESt-AT-027,"Nein, der Vorgang ist nicht grüberwerbsteuerpflichtig, da es sich um einen geschenkten Grundbauhandel handelt."
GRESt-AT-028,"Nein, falls das Grundstück von der ausländischen Botschaft erworben wird, um ihre Botschaft zu errichten, kann es sich um eine öffentliche Aufgabe handeln, die nicht als Eigentumsvermögen der Botschaft angesehen wird. Daher fällt hier keine Grunderwerbsteuer an."
GRESt-AT-029,"Bei einem Liegenschaftstauschvertrag ist die Grunderwerbsteuer gemäß § 11a UStG (Umsatzsteuergesetz) in der Regel nicht zu erheben, da es sich um einen Tausch handelt, nicht um eine Veräußerung. Der Erwerber trägt jedoch die Erwerbssteuer für den Wert der Liegenschaft, die er erhält."
GRESt-AT-030,"Ja, die Entschädigung für die Wertminderung zählt zur Bemessungsgrundlage für mögliche Steuern wie den Grundsteuerzuschlag."
GRESt-AT-031,"Ja, diese Zahlung zählt zur Bemessungsgrundlage der Grunderwerbsteuer."
GRESt-AT-032,"Nein, die vom Käufer zu zahlende Grunderwerbsteuer ist nicht selbst wieder Teil der Bemessungsgrundlage für eine mögliche erneute Grunderwerbsteuer. Sie dient hierbei als Zahlung an den Erwerb des Grundbesitzes."
GRESt-AT-033,Der Wert des Grundstückes bei der unentgeltlichen Übertragung ist der Erwerbswert gemäß § 135 BGB.
GRESt-AT-034,"Ein Steuerschuldner kann nachweisen, dass der tatsächliche Wert eines Grundstückes geringer ist als der pauschal berechnete Grundstückswert nach der Verordnung, durch eine genaue Bewertung des Grundstücks durch einen unabhängigen Fachmann oder durch Beweis von spezifischen Umständen, die den tatsächlichen Wert senken. Dies könnte beispielsweise die geringe Nutzung, fehlende Infrastruktur oder andere faktorische Einschränkungen sein. Der Schuldner muss jedoch die Möglichkeit und die Notwendigkeit einer solchen Nachprüfung beweisen."
GRESt-AT-035,15%
GRESt-AT-036,"Nein, gibt es keinen Zuschlag zur Grunderwerbsteuer in diesem Fall."
GRESt-AT-037,"Nein, die Grunderwerbsteuer bei einer unentgeltlichen Grundstücksübertragung (Schenkung) muss in einem Singlegeldzahlung geleistet werden. Es gibt keine Möglichkeit, diese Steuer in Raten zu zahlen."
GRESt-AT-038,Die Abgabenerklärung beim Finanzamt muss bis zum 31. Dezember des Jahres nach dem Tod des Erben eingereicht werden.
GRESt-AT-039,Die Aufbewahrungsfrist für Rechtsanwälte und Notare für die im Rahmen der Selbstberechnung erstellten Unterlagen und Urkunden beträgt 10 Jahre.
GRESt-AT-040,"Nein, die Grunderwerbsteuer kann nicht wegen der Herabsetzung des Kaufpreises reduziert werden. Die Grunderwerbsteuer ist ein festgelegter Betrag, der bei der Erwerbung von Grundstücken berechnet wird und unabhängig davon, ob und wie der Kaufpreis später herabgesetzt wird."
GRESt-AT-041,"Ja, eine steuerpflichtige Anteilsvereinigung liegt vor."
GRESt-AT-042,"Nein, diese Aufteilung ist nicht steuerlich zulässig. Als Einheitliches geschlossenes Hotelgelände gelten alle drei Grundstücke als ein einziges Einkaufsobjekt zur Berechnung der Grunderwerbsteuer."
GRESt-AT-043,600.000 Euro
GRESt-AT-044,250.000 Euro
GRESt-AT-045,Die Gegenleistung beträgt 450.000 Euro.
GRESt-AT-046,"Nein, kann er dies nicht geltend machen. Die Grundstückswertverordnung bildet den oberen Schwellenwert für die Berechnung der Grunderwerbsteuer, also kann der Käufer den Wert von 380.000 Euro nicht unterlegen. Der Wert des Grundstücks wird im Sinne der Verordnung gemessen, nicht durch private Gutachten bestimmt."
GRESt-AT-047,"Die Steuersätze für unentgeltliche Erwerbe von Grundstücken wie Schenkungen sind je nach Wert des Grundstücks unterschiedlich:

- Bis zu 10.000 EUR: Steuersatz 0%
- Über 10.000 EUR bis 50.000 EUR: Steuersatz 18%
- Über 50.000 EUR bis 200.000 EUR: Steuersatz 22%
- Über 200.000 EUR bis 500.000 EUR: Steuersatz 25%
- Über 500.000 EUR: Steuersatz 30%"
GRESt-AT-048,"Die Grunderwerbsteuerschuld entsteht am Tag der vollständigen Erteilung der Baugenehmigung, also am 20. Mai 2025."
GRESt-AT-049,Die GmbH bleibt als Steuerschuldner bestehen. Die Veränderung der Gesellschafter hat keinen Einfluss auf den Status des Steuerschuldners.
GRESt-AT-050,Der Erwerbsvorgang muss dem Finanzamt in Österreich bis zum 30. Juni 2025 angezeigt werden.
GRESt-AT-051,"Die Grunderwerbsteuer kann in Österreich von der Erwerberin oder dem Erwerber selbst berechnet werden, wenn sie sich nicht an einen Steuerberater wendet. Diese Selbstberechnung muss innerhalb der ersten 30 Tage nach dem Erwerb des Grundbesitzes erfolgen."
GRESt-AT-052,Der Notar muss die Selbstberechnungserklärung gegenüber der Finanzbehörde (Finanzamt) abgeben. Die Erklärung muss in elektronischer Form übermittelt werden.
GRESt-AT-053,Die Anwältin muss bis zum 31. Mai 2025 die Anmeldung einreichen und bis zum gleichen Termin die Grunderwerbsteuer zahlen. Die Erstversteigerung des Grundbesitzes erfolgt ab dem Tag nach der Anmeldung. Haftung liegt bei der Anwältin selbst.
GRESt-AT-054,"Rechtsanwälte und Notare müssen die im Rahmen der Selbstberechnung erstellten Unterlagen mindestens fünf Jahre aufbewahren. Diese Aufbewahrungspflicht entfällt, wenn die rechtliche Angelegenheit mehr als zehn Jahre zurückliegt oder wenn die rechtlichen Bestimmungen eine andere Aufbewahrungsfrist vorsehen."
GRESt-AT-055,"Der Finanzamt muss der zuständige Finanzamt melden, wenn jemand mindestens 75% der Stimmrechte an einer börsennotierten Gesellschaft erhält."
GRESt-AT-056,"Nein, die bereits bezahlte Grunderwerbsteuer kann nicht zurückgefordert werden. Das liegt an der Regel, dass Grunderwerbsteuer als erhebende Steuer gilt, was bedeutet, dass sie erstattungsfähig ist, wenn das Grundstück tatsächlich erworben wurde. Eine Rückgängim-Rechenschaftsung des Kaufvertrags führt zu einer Annulation des Erwerbs, sodass die erworbenen Rechte und Pflichten nicht mehr bestehen. Daher ist die Grunderwerbsteuer als erbrachtes Geld zu betrachten und kann daher nicht mehr zurückgefordert werden."
GRESt-AT-057,"Mit dem Inkrafttreten am 1. Juli 2025 tritt eine neue Regel zur Berechnung des Anteils der Anteilsvereinigung in Kraft. Die alte Bestimmung, dass der Anteil der Anteilsvereinigung gemäß § 28 Absatz 3 HGB berechnet wird, tritt gleichzeitig außer Kraft."
GRESt-AT-058,"Nein, dieser Erwerb löst keine Grunderwerbsteuer aus. Der Erwerb von Anteilen an einer grundbesitzenden GmbH ist in Österreich nicht als Grunderwerbsteuerbelastend gesehen, wenn die Anteile bereits am selben Tag (oder kurz danach) nach der Grundbesitzung erworben werden."
GRESt-AT-059,Die geänderten Selbstberechnungsregeln treten am 1. Januar 2026 in Kraft.
GRESt-AT-060,Die Abgabenerklärung muss bis zum 31. Dezember 2026 eingereicht werden.
GRESt-AT-061,"Ja, der 85-jährige Hauseigentümer hat stets die Grunderwerbsteuer abzuführen, solange er das Grundstück und das Haus besessen hat. Die Erhebung der Grunderwerbsteuer richtet sich nach dem Besitzrecht, nicht nach der tatsächlichen Nutzung oder Lebensweise des Eigentümers."
GRESt-AT-062,"Die Grunderwerbssteuer wird für den Landwirt im Sinne der § 13a UStG berechnet. Da er Eigentümer von Agrarflächen ist, gilt die Grunderwerbssteuerrate von 25%. Für den Verkauf der Agrarflächen muss die gesamte Ertrag aus der Erzeugung von Erzeugnissen berechnet werden, um die Grundrechteinhaberschaft zu beibehalten. Der Verkauf des Hofhauses, der nicht mehr nutzbar ist, kann als Vermögensveränderung behandelt werden, aber nicht als Ertrag aus der Erzeugung von Erzeugnissen. Daher muss der Landwirt die Vermögensveränderung im Rahmen der Vermögenssteuer berücksichtigen, nicht in der Grunderwerbssteuer."
GRESt-AT-063,"Der Vermittlung des Grundstücks unentgeltlich an den Ehemann der Eigentümerin erfolgt als Geschenk. Dies führt zu einer Erbvermehrung für den Ehemann, da es sich um einen geschenklichen Erwerb handelt. Der Ehemann muss jedoch in der Regel im Rahmen der Erbfolgeordnung eine Erbprüfung durchführen, um festzustellen, ob er als Erbgeschenk oder als Geschenk an den Ehepartner behandelt werden soll."
GRESt-AT-064,"Nein, nach dem Grundstückerlebnis (GrEStG) gilt ein Superädädikat nicht als Grundstück. Es ist ein eigenständiges Gebäude, das auf fremdem Grund steht."
GRESt-AT-065,Nein.
GRESt-AT-066,"Nein, der Erwerb des Grundstücks gilt nicht als unentgeltlich. Es handelt sich um einen bargeldlosen Zahlungswechsel, der jedoch nicht als unentgeltliche Transaktion angesehen wird, da es sich um eine Vereinbarung zur Erfüllung eines Pflichtteilsanspruchs handelt."
GRESt-AT-067,Der Meistbieter ist grüberwerbsteuerrechtlich der Steuerschuldner.
GRESt-AT-068,"Nein, die Steuer kann nicht nach dem niedrigeren Kaufpreis berechnet werden. Der Grundstücksteuerwert wird vom tatsächlichen Kaufpreis abhängig bestimmt, jedoch ist der Kaufpreis nicht als Basis für die Steuer berechnet, sondern der Grundstückswert selbst."
GRESt-AT-069,"Der Vorgang unterliegt der Grunderwerbsteuer. Der Steuerschuldner ist der Verkäufer, da er den Anspruch auf Übereignung durch den Kaufvertrag begründet hat."
GRESt-AT-070,"Nein, diese Abtretung ist nicht grupperwerbsteuerpflichtig. Die Grüberwerbsteuer gilt nur für den Übergang von einem Eigentümer zum anderen. Der Anspruch auf Übereignung ist eine rechtliche Verpflichtung und nicht das eigentliche Grundstück."
GRESt-AT-071,"Ja, der Vorgang ist nach dem GrEStG 1987 steuerbar."
GRESt-AT-072,"Der Erbschaftsteuer nach dem Erbgut- und Vermögenssteuergesetz (GrEStG) wird nach der Wertbetragsbegründung berechnet, wenn das Erbe unentgeltlich oder mit geringer Gegenleistung übertragen wird. In diesem Fall würde die Bemessungsgrundlage der Erbschaftsteuer auf den Wert der Liegenschaft beruhen, der sich aus dem Kaufpreis des Grundstands und möglichen Kosten für die Einrichtung und Veräußerung ermittelt."
GRESt-AT-073,"Nein, die gesamte Teilung ist nicht steuerfrei. Der Erhalt eines wertvolleren Teilsgrundstücks als der Bruchteil angemessen entspricht kann zu einem Mehrwertsteuerbelasteten Vermögensveränderungseintrag führen."
GRESt-AT-074,"Nein, der Erwerb des Grundstücks ist nicht automatisch steuerfrei. Die Übertragung eines Grundstücks durch eine Gemeinde kann in bestimmten Fällen steuerfrei sein, wenn sie zum Zweck der Gemeindeordnungsplanung oder -gestaltung vorgenommen wird. In diesem Fall könnte das Grundstück als gemeinnützig gelten. Es ist jedoch notwendig, dass die Übertragung tatsächlich zur Verbesserung der Gemeindeinfrastruktur oder der öffentlichen Verwaltung dient. Einzelheiten müssen im Kontext der jeweiligen Steuergesetze und der具体情况 prüft werden."
GRESt-AT-075,"Ja, der Grundstückserwerb im Rahmen eines behördlichen Zusammenlegungsverfahrens ist in der Regel grüberwerbsteuerfrei."
GRESt-AT-076,"Ja, nach dem GrEStG (Grundsteuergesetz) gehört die Produktionsmaschine für Zwecke der Grundstückssteuer zum Betriebsgrundstück."
GRESt-AT-077,"Ja, auch in diesem Fall ist die Grüberwerbsteuer relevant. Die Person hat rechtlich und wirtschaftlich das Grundstück in Anspruch genommen, was den Anhaltspunkt für eine Erwerbsbeamtigkeit bildet."
GRESt-AT-078,"Ja, falls das Grundstück ohne vorhergehenden Kaufvertrag unmittelbar in das Eigentum des Erwerbers geht, kann trotzdem Grunderwerbsteuer erhoben werden, wenn es sich um Grundstücke handelt, die im Sinne der Grunderwerbsteuergesetzgebung als ""Grundstücke der ersten Klasse"" gelten. Dies hängt von der Art und Lage des Grundstücks sowie von den Umständen ab."
GRESt-AT-079,"Ja, auch dieser bloße Rechtserwerb unterliegt der Grunderwerbsteuer."
GRESt-AT-080,"Ja, diese Zahlung an den Dritten gehört zur grupperwerbsteuerlichen Gegenleistung."
GRESt-AT-081,"Nein, die Steuer kann auf Antrag nicht festgesetzt werden. Die Grunderwerbsteuer ist als erhebende Steuer bestimmt, was bedeutet, dass sie unabhängig von der tatsächlichen Nutzung oder dem Verkauf des Grundstücks erhoben wird. Daher bleibt sie anhaftend, auch wenn der Vertrag rückgängig gemacht wird."
VAT-INTL-001,"Eine sonstige Leistung bezeichnet in der Steuerlehre eine Leistung, die nicht als Hauptleistung oder Nebenleistung gezählt wird. Sie kann z.B. zusätzliche Dienstleistungen sein, die mit einer Hauptleistung verbunden sind, aber nicht als Teil dieser Hauptleistung angesehen werden."
VAT-INTL-002,"Sonstige Leistungen, die nicht in einer Lieferung bestehen, können beispielsweise Beratungsleistungen, technische Unterstützung, Software-Dienste oder Dienstleistungen zur Betreuung von Produktionsprozessen oder -umgebungen sein."
VAT-INTL-003,"Die folgenden Leistungen sind im Steuergesetz gegen Entgelt gleichgestellt:

1. Dienstleistungen von Haushaltsstellen
2. Dienstleistungen von gemeinnützigen Vereinen
3. Dienstleistungen von Gewerbehäusern
4. Dienstleistungen von Privathaushalten
5. Dienstleistungen von Selbstständigen

Diese Leistungen sind steuerlich nicht zu beklagen, wenn sie im Rahmen des gewerblichen oder privaten Lebensunterhalts geleistet werden."
VAT-INTL-004,"Die Verwendung eines dem Unternehmen zugeordneten Gegenstands für private Zwecke oder für den Bedarf des Personals gilt als sonstige Leistung, wenn diese Verwendung nicht in der normalen Arbeitsweise des Unternehmens enthalten ist und nicht zur Erreichung der Arbeitsziele beiträgt. Dies entspricht Regelungen im Steuergesetz, insbesondere in Bezug auf das Berechnungsgrundstück für Steuerzwecke."
VAT-INTL-005,Die unentgeltliche Erbringung anderer sonstiger Leistungen für private Zwecke oder den Bedarf des Personals gilt nicht als steuerbare Leistung.
VAT-INTL-006,"Ein tauschähnlicher Umsatz liegt vor, wenn sich der Erwerber des Warenverkaufs durch den Kauf der Ware nicht nur auf Kosten und Ausgaben, sondern auch auf Gewinne oder andere Nutzen verbindet. Dies kann beispielsweise in der Form eines zusätzlichen Services oder einer zusätzlichen Leistung stattfinden, die dem Erwerber zugutekommt."
VAT-INTL-007,"Die Überlassung eines gleichartigen Gegenstandes anstelle des herzustellenden Gegenstandes gilt als sonstige Leistung, wenn der Antragsteller nachweislich keinen Zugang zu dem zu liefernden Gegenstand hat oder dies wegen rechtlicher Einschränkungen nicht erzielen kann."
VAT-INTL-008,"Entgelte, die für eine nicht direkt leistete, sondern nur weil sie zur Verfügung gestellt wird, erforderlich sind, können als Entgelt für eine sonstige Leistung im Sinne eines tauschähnlichen Umsatzes gedeutet werden. Dies gilt insbesondere bei der Verleihung von Waren oder Dienstleistungen, deren Nutzung jedoch nicht erzwungen ist."
VAT-INTL-009,"Eine Werkleistung bezeichnet in der Steuerrechtsperspektive den Wert der Arbeit, die von einem Arbeitnehmer geleistet wird, um einen bestimmten Leistungsbereich zu erbringen. In diesem Kontext kann es sich um Dienstleistungen handeln, die zum Beispiel durch einen Künstler oder einen Ingenieur geleistet werden. Der Wert dieser Leistung wird dann zur Berechnung des Steuerpflichtensatzes verwendet."
VAT-INTL-010,"Ja, eine Leistung kann ohne aktiveres Tun des Unternehmers vorliegen, wenn sie durch den normalen Betrieb oder der Tätigkeit des Unternehmens entsteht. Dies gilt insbesondere für automatisierte Prozesse oder automatisierte Systeme, die ohne direkte Handlung des Unternehmers funktionieren."
VAT-INTL-011,"Das UStG (Umsatzsteuergesetz) legt folgende Regelung fest: Lieferungen sind von anderen Leistungen getrennt, wenn sie in einem anderen Vertragsabschnitt als die Leistung oder eine andere Leistung enthalten sind. Wenn eine Lieferung mit einer anderen Leistung in einem Vertrag vereinbart wird, ist die gesamte Leistung steuerpflichtig."
VAT-INTL-012,"Eine unentgeltliche sonstige Leistung gilt als entgeltlich, wenn sie durch den Nutzen oder die Erleichterung der Nutzung von Gütern oder Dienstleistungen erzielt wird, die dem Entgelt entsprechend wertvoll sind."
VAT-INTL-013,"Ja, liegt ein tauschähnlicher Umsatz vor, wenn eine Leistung nicht in Geld, sondern durch eine andere Leistung oder einen Dienst ersetzt wird. Dies gilt insbesondere bei der Vergabe von Preisen für Dienstleistungen, wo der Käufer nicht direkt bezahlt, sondern durch die erhaltenen Dienste den Verkäufer ""bezahlt""."
VAT-INTL-014,Der Umsatz liegt in diesem Fall bei der erstellten Grafikdienstleistung (Logo). Der Laptop als Gegenleistung gehört zu den Nebenprodukten oder Nebeneinkünften und ist nicht Teil des Hauptumsatzes.
VAT-INTL-015,"Der Umsatz für die kostenlose Mahlzeit kann als freier Umsatz qualifiziert werden, da er nicht direkt in einen vertraglich festgelegten Preis für die Bilder überführt wird. Er dient eher der Belohnung für den Service und ist daher nicht als gewerblicher Umsatz zu bezeichnen."
VAT-INTL-016,"Die Leistung des Schneiders besteht hier in der Anfertigung eines neuen Anzugs anhand des übergebenen Stoffes. Da der Schneider jedoch einen bereits fertigen Anzug aus seinem Bestand verwendet und einen festen Werklohn verrechnet, handelt es sich um eine Überschätzung seiner tatsächlichen Leistung. Dies könnte zu einer Steuererhöhung führen, da der Schneidersbeitrag möglicherweise höher als der tatsächliche Wert der Leistung sein wird."
VAT-INTL-017,"Der Umsatz liegt bei dem pauschalen Werklohn, da der Tisch als fertiggestelltes Produkt verhandelt wurde. Der Tisch, der aus dem Lager stammt, ist kein neues Produkt, das aufgrund der Lieferung des Holzes erstellt wurde."
VAT-INTL-018,"Die umsatzsteuerliche Behandlung hängt von der Art der Verträge ab, die zwischen dem Eventmanager, dem Drittanbieter und dem Kunden geschlossen werden. Es gibt zwei mögliche Szenarien:

1. **Vertrag mit direktem Umsatzsteuerbelastung:** Wenn der Eventmanager den Drittanbieter direkt bezahlt und der Drittanbieter den Kunden das Catering-Leistungserbringen verspricht, kann der Eventmanager den Umsatzsteuerbelastungskennwert (USBK) verwenden.

2. **Vertrag ohne direkte Umsatzsteuerbelastung:** Wenn der Eventmanager den Kunden eine Leistung zur Verfügung stellt (z.B. Veranstaltungserstellung), während der Drittanbieter den Umsatz erzielt, kann der Eventmanager den Umsatzsteuerfreibetrag nutzen oder eine andere Umsatzsteuerabgabeart anwenden, je nach Umständen und rechtlichen Rahmenbedingungen.

In beiden Fällen ist es wichtig, die具体情况准确识别和遵循相关税法规定。"
VAT-INTL-019,Diese IT-Dienstleistung wird als eigene Dienstleistung des Unternehmers behandelt und erfasst entsprechend in der Steuererklärung. Der Auftrag an einen Dritten ist lediglich eine Vertragsform zur Durchführung der Dienstleistung.
VAT-INTL-020,"Die Leistungen des Reisebüros und des Hotels sind getrennt zu behandeln. Das Reisebüro erledigt eine Vermittlungsleistung, die umsatzsteuerpflichtig ist. Das Hotel bietet eine Unterkunftsleistung an, die ebenfalls umsatzsteuerpflichtig ist. Die Umsatzsteuer wird vom Reisebüro abgezogen und an das Hotel überwiesen."
VAT-INTL-021,"Der Ort der Leistung für die Umsatzsteuer ist Wien, da die Privatperson, die das Monatsabo für Filme in Österreich erworben hat, in Wien lebt."
VAT-INTL-022,"Der steuerliche Leistungsort für diese Gebühren nach österreichischem Recht ist Innsbruck. Da der Kunde den größten Teil seiner Zeit in dieser Wohnung verbringt und die Leistungen ausschließlich dort genutzt werden, entspricht dies dem Prinzip des „Ordnungssitzes“, das in diesem Fall den Wohnort in Innsbruck ausrichtet."
VAT-INTL-023,"Nein, gilt hier das Prinzip des Wohnsitzes des Empfängers nicht. Für elektronische Dienstleistungen an Nichtunternehmer gelten im EU-Rahmen die Richtlinien über elektronische Dienstleistungen (eGDS), die das Rechtssystem Österreich nicht automatisch umfassen. Stattdessen wird hier wahrscheinlich das Rechtssystem des Vertragsparties Anwendung finden, insbesondere wenn es sich um eine internationale Vereinbarung handelt."
VAT-INTL-024,"Der steuerliche Leistungsort für diese Mobilfunkrechnungen liegt in Österreich. Der Wohnsitz der Nutzerin ist dort festgelegt, unabhängig davon, wo sie sich während eines bestimmten Jahres aufhält."
VAT-INTL-025,"In diesem Fall gilt die Leistung als ausgeführt im Standort des Vermittlers, also Österreich. Das ist nach österreichischem Steuerrecht der Fall, wenn die Leistung nicht in Österreich stattfindet, sondern durch einen österreichischen Geschäftspartner oder -unternehmen erbracht wird."
VAT-INTL-026,Der Ort der Leistung für die Umsatzsteuer in diesem Fall ist Österreich.
VAT-INTL-027,Österreich
VAT-INTL-028,"Ein Geschäftspartner oder Kunde, bei dessen Unternehmen die sonstige Leistung stattfindet."
VAT-INTL-029,"Der Umsatztyp in diesem Fall ist der ""Umsatz aus dem Verkauf von Werbeeinrichtungen""."
VAT-INTL-030,Der Ort der sonstigen Leistung ist Wien.
VAT-INTL-031,Graz
