id,answer
CORP-TAX-001,"Die steuerliche Bemessungsgrundlage für die Körperschaftsteuer ist gemäß § 18 Abs. 1 KStG der Gewinn der Körperschaft, der nach den Vorschriften des Einkommensteuergesetzes (EStG) ermittelt wird.

Gemäß § 18 Abs. 1 KStG ist der Gewinn der Körperschaft die Summe der Gewinne der im Kalenderjahr gezeigten Geschäftsjahre, abzüglich der Verluste der im Kalenderjahr gezeigten Geschäftsjahre. Der Gewinn ist nach den Vorschriften des EStG zu ermitteln, wobei die Körperschaftsteuer auf den Gewinn anfällt.

Es ist jedoch zu beachten, dass die Körperschaftsteuer nicht nur auf den Gewinn anfällt, sondern auch auf andere Einkünfte, wie z.B. Einkünfte aus Vermietung und Verpachtung (§ 22 KStG)."
CORP-TAX-002,"Die Frage ist jedoch nicht direkt mit den angegebenen Gesetzestexten verbunden. Die Frage bezieht sich auf die steuerlichen Konsequenzen der Vergabe eines zinslosen Darlehens durch eine Körperschaft an ihren Gesellschafter. Dies ist ein Thema des Körperschaftsteuerrechts (KStG) und nicht direkt mit dem Umsatzsteuerrecht (UStG) verbunden.

Gemäß § 8 Abs. 3 KStG ist ein Darlehen, das eine Körperschaft an einen Gesellschafter vergibt, als Sonderbetriebsvermögen anzusehen, wenn es nicht zu einem Verlust führt. Wenn das Darlehen zinslos ist, bedeutet dies, dass die Körperschaft keine Zinsen auf das Darlehen erhält. Dies kann jedoch keine direkte steuerliche Konsequenz haben, da die Körperschaft keine Einnahmen aus dem Darlehen erzielt.

Es ist jedoch zu beachten, dass die Vergabe eines zinslosen Darlehens an einen Gesellschafter als eine Form der Dividenden"
CORP-TAX-003,"Laut § 50 Abs. 2 Z 3 des Bewertungsgesetzes 1955 sind Körperschaften verpflichtet, sämtliche Einkünfte den Einkünften aus Gewerbebetrieb zuzurechnen, wenn sie als rechnungslegungspflichtige Gewerbetreibende gelten.

Gemäß § 189 Abs. 1 UGB gilt eine Gesellschaft als rechnungslegungspflichtiger Gewerbetreibender, wenn sie Einkünfte aus Gewerbebetrieb erzielt. Dies gilt auch für Gesellschaften, die auf Antrag als rechnungslegungspflichtige Gewerbetreibende gelten.

Daher sind Körperschaften, die als rechnungslegungspflichtige Gewerbetreibende gelten, verpflichtet, sämtliche Einkünfte den Einkünften aus Gewerbebetrieb zuzurechnen."
CORP-TAX-004,"Eine interessante Frage!

Lassen Sie mich zunächst auf die relevanten Gesetzestexte hinweisen:

* § 98 EStG (Einkommensteuergesetz)
* § 23 Angestelltengesetz (oder gleichartige österreichische Rechtsvorschriften)
* § 6 Z 6 lit. c und d EStG (Abfertigungsrückstellung)
* § 6 EStG (Anschaffungskosten)

Jetzt zur Frage:

(a) Bei der Tochtergesellschaft:

Eine Dividende ist eine Einnahme der Tochtergesellschaft und unterliegt der Körperschaftsteuer (KSt). Gemäß § 2 KStG (Körperschaftsteuergesetz) unterliegen die Einkünfte der Körperschaftsteuer, wenn sie in Österreich erzielt werden. Die Dividende ist also in Österreich besteuert.

(b) Bei der österreichischen Muttergesellschaft:

Die Muttergesellschaft erhält die Dividende als Einnahme und unterliegt der Einkommensteuer (ESt)."
CORP-TAX-005,"Die steuerliche Behandlung einer offenen von einer verdeckten Ausschüttung auf Ebene der ausschüttenden Körperschaft unterscheidet sich insbesondere bei der Ermittlung des Einkommens und der Besteuerung.

Eine offene Ausschüttung (§ 8 Abs. 4 Z 1 EStG) ist eine Ausschüttung, bei der die Gesellschaft dem Gesellschafter einen bestimmten Betrag an Geld oder Werten überträgt. Diese Ausschüttung ist steuerlich als Einkünfte des Gesellschafters zu behandeln und unterliegt der Einkommensteuer.

Eine verdeckte Ausschüttung (§ 8 Abs. 4 Z 2 EStG) ist eine Ausschüttung, bei der die Gesellschaft dem Gesellschafter einen Vorteil gewährt, ohne dass ein bestimmter Betrag an Geld oder Werten übertragen wird. Beispiele für verdeckte Ausschüttungen sind die Übertragung von Wirtschaftsgütern oder die Gewährung von Krediten.

Die wichtigste D"
CORP-TAX-006,"Laut § 30a Abs. 1 EStG beträgt der maximal mögliche Verlustabzug in einem Veranlagungsjahr 60% des Verlustes. Der Verlust ist gleichmäßig auf das Jahr der Verlustentstehung und die folgenden vierzehn Jahre zu verteilen und ausschließlich mit Einkünften aus Vermietung und Verpachtung abzuziehen, soweit diese unter § 18 Abs. 6 und 7 EStG nicht zulässig sind.

Es gibt jedoch Ausnahmen:

* In den Kalenderjahren 1989 und 1990 entstandene Verluste können zu je einem Fünftel bei den Veranlagungen der Jahre 1998 bis 2002 abgezogen werden (§ 30a Abs. 1 EStG).
* In Fällen, in denen ein Verlust aus vorangegangenen Jahren von einem bei der Veranlagung für die Kalenderjahre 1996 oder 1997 zu berücksichtigenden Veräußerungs-, Aufgabe- oder Liquidationsgewinn abz"
CORP-TAX-007,"Ein Mantelkauf ist ein Erwerbsvorgang, bei dem ein Steuerpflichtiger ein Grundstück (z.B. ein Haus oder eine Wohnung) kauft, ohne dass der Verkäufer eine Gegenleistung erhält. Der Verkäufer erhält jedoch eine andere Gegenleistung, z.B. eine andere Immobilie oder eine Geldzahlung, die nicht direkt mit dem Grundstück zusammenhängt.

Gemäß § 15 EStG liegen Einnahmen vor, wenn dem Steuerpflichtigen Geld oder geldwerte Vorteile im Rahmen der Einkunftsarten des § 2 EStG zugehen. Bei einem Mantelkauf liegt jedoch kein geldwerter Vorteil im Sinne des § 2 EStG vor, da der Verkäufer keine Gegenleistung erhält, die direkt mit dem Grundstück zusammenhängt.

Gemäß § 4 Abs. 3 EStG sind jedoch auch geldwerte Vorteile anzusetzen, die nicht direkt mit dem Grundstück zusammenhängen, wenn sie im Rahmen eines Mantelkaufs"
CORP-TAX-008,"Bei einem Forderungsverzicht eines Gesellschafters ist die Steuerfolgen für die Körperschaft im Wesentlichen durch § 2 Abs. 1 KStG und § 3 Abs. 13 EStG bestimmt.

§ 2 Abs. 1 KStG regelt die Steuerpflicht der Körperschaft. Danach ist die Körperschaft steuerpflichtig, wenn sie in Österreich ansässig ist oder in Österreich eine Betriebsstätte hat.

§ 3 Abs. 13 EStG regelt die Steuerfolgen von Forderungsverzichten. Danach gilt: ""Wenn ein Gesellschafter einen Anspruch gegen das Unternehmen verliert, ohne dass ein Geldbetrag oder ein anderes Vermögenswert ausgetauscht wird, so ist der Verlust des Anspruchs als Einkünfte aus Gewerbebetrieb zu berücksichtigen.""

In diesem Zusammenhang ist jedoch auch § 3 Abs. 14 EStG relevant, der regelt, dass der Verlust des Anspruchs als Einkünfte aus Gewerbebetrieb"
CORP-TAX-009,"Die Verlustverrechnung von ausländischen Gruppenmitgliedern unterscheidet sich von der inländischer Gruppenmitglieder in folgenden Punkten:

1. **Zurechnung von Verlusten**: Ausländische Gruppenmitglieder, die nicht unbeschränkt steuerpflichtig sind, können ihre Verluste nicht unbeschränkt zurechnen lassen (§ 5 Abs. 1 EStG). Sie können nur 75% ihrer Verluste zurechnen lassen, wenn sie an unbeschränkt steuerpflichtige Gruppenmitglieder oder an den Gruppenträger beteiligt sind.
2. **Vortrag von Verlusten**: Wenn die Verluste eines ausländischen Gruppenmitglieds nicht im laufenden Jahr berücksichtigt werden können, können sie in folgenden Jahren als vortragsfähige Verluste des Gruppenträgers abgezogen werden (§ 5 Abs. 1 EStG).
3. **Verrechnung von Verlusten mit Gewinnen**: Wenn ein ausländ"
CORP-TAX-010,"Laut § 12 Abs. 3 Z 5 EStG sind Steuerumlagen zum Zwecke des Ausgleichs der steuerlichen Wirkungen, die sich aus der Zurechnung der Einkommen der Gruppenmitglieder zum Gruppenträger ergeben, steuerneutral. Das bedeutet, dass diese Steuerumlagen nicht steuerpflichtig sind.

Es ist jedoch zu beachten, dass § 12 Abs. 3 Z 5 EStG nur für Steuerumlagen zwischen Gruppenmitgliedern und Gruppenträgern gilt, die unbeschränkt steuerpflichtig sind. Wenn es sich um nicht unbeschränkt steuerpflichtige ausländische Gruppenmitglieder handelt, sind nur die nach § 92 Abs. 1 lit. b BAO festzustellenden Einkünfte steuerpflichtig (§ 12 Abs. 3 Z 6 EStG).

Insgesamt kann man sagen, dass Steuerumlagen zwischen Gruppenträgern und Gruppenmitgliedern, die unbeschränkt steuerpf"
CORP-TAX-011,"Laut § 8 Abs. 4 Z 2 des GrEStG können Abschreibungen auf den niedrigeren Teilwert einer Beteiligung an einem Gruppenmitglied nicht verrechnet werden, soweit in diesen Abschreibungen auf den niedrigeren Teilwert Vorgruppenverluste enthalten sind.

Allerdings ist zu beachten, dass § 6 Z 2 lit. a des EStG 1988 besagt, dass vortragsfähige Verluste und Veräußerungsverluste hinsichtlich von Beteiligungen an Gruppenmitgliedern nicht abzugsfähig sind.

Daher lautet die Antwort: Nein, Abschreibungen auf den niedrigeren Teilwert einer Beteiligung an einem Gruppenmitglied sind nicht abzugsfähig, soweit in diesen Abschreibungen auf den niedrigeren Teilwert Vorgruppenverluste enthalten sind.

Relevante Paragraphen:

* § 8 Abs. 4 Z 2 des GrEStG
* § 6 Z 2 lit. a des E"
CORP-TAX-012,"Eine Dividende einer ausländischen EU-Tochtergesellschaft wird steuerlich behandelt, wenn die Beteiligung mindestens 10 % beträgt und während eines ununterbrochenen Zeitraumes von mindestens einem Jahr bestanden hat (§ 1 Abs. 2 KStG 1988).

Da die Beteiligung 15 % beträgt und seit 2 Jahren gehalten wird, erfüllt sie die Voraussetzungen für die steuerliche Behandlung als Gewinnanteil (Dividende).

Gemäß § 7 Abs. 3 EStG fallen Steuerpflichtige vergleichbar sind, nachweislich in Form von Kapitalanteilen während eines ununterbrochenen Zeitraumes von mindestens einem Jahr mindestens zu einem Zehntel an ausländischen Körperschaften, die einer inländischen Kapitalgesellschaft vergleichbar sind, beteiligt sind.

Da die ausländische EU-Tochtergesellschaft einer inländischen Kapitalgesellschaft vergleichbar ist und die Beteiligung die Voraussetzungen erfü"
CORP-TAX-013,"Um die Frage zu beantworten, müssen wir die Voraussetzungen für die Anwendung von § 10 KStG (Beteiligungsbefreiung) und § 12 Abs. 1 Z 10 KStG (Abzugsverbot für Lizenzgebühren) analysieren.

§ 10 KStG regelt die Beteiligungsbefreiung, die es ermöglicht, dass eine Körperschaft (z.B. eine Aktiengesellschaft) bestimmte Einkünfte ohne Körperschaftsteuer zu versteuern hat, wenn diese Einkünfte aus einer Beteiligung an einer anderen Körperschaft stammen. Die Beteiligungsbefreiung gilt jedoch nur, wenn die Beteiligung an der anderen Körperschaft mindestens 10 % der Stimmrechte oder des Grundkapitals umfasst.

§ 12 Abs. 1 Z 10 KStG regelt das Abzugsverbot für Lizenzgebühren, das besagt, dass Lizenzgebühren, die von einer Körperschaft an eine andere Körperschaft gez"
CORP-TAX-014,"Eine internationale Schachtelbeteiligung liegt vor, wenn die folgenden Voraussetzungen erfüllt sind:

1. Es handelt sich um eine internationale Schachtelbeteiligung im Sinne des § 7 Abs. 2 EStG.
2. Die internationale Schachtelbeteiligung ist mit ausländischen Beteiligungserträgen im Sinne des § 5 Z 6 EStG verbunden.
3. Die Körperschaft, die die internationale Schachtelbeteiligung hat, ist mit ihrem Ansässigkeitsstaat eine umfassende Amtshilfe abgeschlossen (§ 10 EStG).

Diese Voraussetzungen sind erforderlich, um eine Befreiung von der Körperschaftsteuer (KStG) und der Umsatzsteuer (UStG) zu erhalten."
CORP-TAX-015,"Laut § 7 Abs. 2 Z 7 des Einkommensteuergesetzes (EStG) liegt eine internationale Schachtelbeteiligung vor, wenn unter bestimmten Voraussetzungen eine Körperschaft mit einer ausländischen Körperschaft vergleichbar ist und mit deren Ansässigkeitsstaat eine umfassende Amtshilfe besteht.

Veräußerungsgewinne aus internationalen Schachtelbeteiligungen fallen nicht unter die umfassende Amtshilfe und werden daher grundsätzlich nach den Vorschriften des § 7 Abs. 3 des EStG behandelt.

Gemäß § 7 Abs. 3 des EStG gilt für Bezüge und Vorteile aus ausländischen Einrichtungen im Sinne des § 7 Abs. 3, die mit deren Ansässigkeitsstaat eine umfassende Amtshilfe besteht, dass sie nicht besteuert werden, wenn sie nicht unter Z 7 fallen.

Da Veräußerungsgewinne aus internationalen Schachtelbete"
CORP-TAX-016,"Die Frage nach der Abzugsfähigkeit von Fremdfinanzierungszinsen für den Erwerb einer steuerbefreiten Beteiligung ist komplex und erfordert eine sorgfältige Analyse der einschlägigen Gesetze und Vorschriften.

Gemäß § 6 Abs. 1 Z 8 EStG sind Einlagen bei Kreditinstituten, die für steuerfreie Umsätze getätigt werden, steuerfrei. Dies umfasst auch die Umsätze von gesetzlichen Zahlungsmitteln und inländischen amtlichen Wertzeichen.

Wenn wir uns nun auf die steuerliche Behandlung von Fremdfinanzierungszinsen konzentrieren, ist zu beachten, dass diese gemäß § 24 EStG als Betriebsausgaben abzugsfähig sind, wenn sie für die Erzielung von Einnahmen oder für die Herstellung von Wirtschaftsgütern verwendet werden.

Allerdings ist die steuerliche Behandlung von Beteiligungen an Unternehmen komplex und unterliegt verschiedenen Vorschriften. Gemäß §"
CORP-TAX-017,"Der Unterschied zwischen § 11 KStG und § 12 KStG in Bezug auf den Betriebsausgabenabzug liegt in der Art der Zuwendungen, die abgezogen werden können.

§ 11 KStG regelt die Zuwendungen an verbundene Unternehmen. Hierbei handelt es sich um Zuwendungen, die von einer Körperschaft an ein verbundenes Unternehmen geleistet werden. Diese Zuwendungen müssen auf Verlangen der Abgabenbehörde durch Vorlage eines Belegs nachgewiesen werden (§ 1 Abs. 2 KStG 1988).

§ 12 KStG regelt dagegen die Zuwendungen an nicht verbundene Unternehmen. Hierbei handelt es sich um Zuwendungen, die von einer Körperschaft an ein nicht verbundenes Unternehmen geleistet werden. Diese Zuwendungen können nur dann abgezogen werden, wenn sie im unternehmensrechtlichen Jahresabschluss eines späteren Wirtschaftsjahres als Betriebsausgaben berücksichtigt werden.

Insgesamt kann man sagen, dass § 11 KStG die Zuwendungen an"
CORP-TAX-018,"Nein, freiwillige Spenden zu gemeinnützigen Zwecken sind grundsätzlich nicht abzugsfähig. Gemäß § 4d Abs. 4 EStG sind nur bestimmte Arten von freiwilligen Zuwendungen abzugsfähig, wie z.B. Freiwillige soziale Zuwendungen des Arbeitgebers an den Betriebsratsfonds, freiwillige Zuwendungen zur Beseitigung von Katastrophenschäden oder Ortsübliche Trinkgelder.

Freiwillige Spenden zu gemeinnützigen Zwecken sind jedoch nicht in dieser Liste enthalten. Gemäß § 4d Abs. 4 EStG sind nur die in der Liste genannten Arten von freiwilligen Zuwendungen abzugsfähig, und nicht alle Arten von Spenden.

Es ist jedoch zu beachten, dass bestimmte Spenden an gemeinnützige Organisationen abzugsfähig sein können, wenn sie bestimmte Voraussetzungen erfüllen, wie z.B. die Spende an eine Organisation, die von der Finanzverwaltung als geme"
CORP-TAX-019,"Basierend auf den angegebenen Gesetzestexten, können wir folgende Aufwendungen bei einer GmbH steuerlich nicht oder nur teilweise abzugsfähig ermitteln:

(a) EU-Geldbuße: Eine Geldbuße ist keine Betriebsausgabe im Sinne des § 4 Abs. 4 EStG. Sie ist daher nicht abzugsfähig.

(b) Spende an begünstigten Empfänger: Eine Spende an einen begünstigten Empfänger kann steuerlich abzugsfähig sein, wenn sie nach § 10 Abs. 1 KStG 1988 aus Beteiligungen an Arbeitgebergesellschaften gemäß Abs. 5 Z 1 an die Begünstigten dient. In diesem Fall ist die Spende nur insoweit abzugsfähig, als es sich um Beteiligungen an Arbeitgebergesellschaften gemäß Abs. 5 Z 1 oder um den für die Anschaffung solcher Beteiligungen notwendigen Geldbetrag handelt.

(c) Aufsichtsratsvergütung: Eine Aufsicht"
CORP-TAX-020,"Lizenzgebühren an eine konzernzugehörige Gesellschaft sind nicht abzugsfähig, wenn die beherrschende Körperschaft mehr als 50 % der Stimmrechte oder des Kapitals oder Anspruch auf mehr als 50 % der Gewinne der Personenvereinigung hat (§ 1 Abs. 3 Z 1 EStG).

In diesem Fall unterliegen die Einkünfte aus der Beteiligung an einem umgekehrt hybriden Unternehmen weder im Ansässigkeitsstaat der beherrschenden Körperschaft noch im Inland (§ 1 Abs. 3 Z 3 EStG).

Dies bedeutet, dass die Lizenzgebühren an die konzernzugehörige Gesellschaft nicht als Betriebsausgaben abzugsfähig sind, da die Einkünfte aus der Beteiligung an einem umgekehrt hybriden Unternehmen nicht steuerpflichtig sind."
CORP-TAX-021,"Laut § 124b Z 4 EStG (Einkommensteuergesetz) ist der Gewinn bei rechnungslegungspflichtigen Körperschaften nach der Gewinnermittlung nach § 4 Abs. 1 KStG (Körperschaftsteuergesetz) zu ermitteln.

§ 4 Abs. 1 KStG lautet:

""(1) Die Körperschaftsteuer ist nach der Ermittlung des Gewinns nach den Vorschriften der §§ 8 bis 10 zu erheben.""

§ 8 KStG regelt die Gewinnermittlung nach der Betriebsvermögensvergleichsmethode, § 9 KStG regelt die Gewinnermittlung nach der Einnahmen-Überschussrechnungsmethode und § 10 KStG regelt die Gewinnermittlung nach der Einnahmen-Überschussrechnungsmethode mit Anrechnung von Verlusten aus vorangegangenen Jahren.

Da die Frage jedoch nach der Methode fragt, bei der der Gewinn"
CORP-TAX-022,"Um eine Gruppe zu bilden, müssen die Voraussetzungen des § 8 Abs. 3 Z 1 zweiter Teilstrich des Einkommensteuergesetzes (EStG) erfüllt sein. Hierbei ist insbesondere die Stellung als Mitunternehmer gemäß § 26c Z 8 des EStG zu berücksichtigen.

Da die GmbH 60 % einer anderen GmbH erwirbt, handelt es sich um eine Beteiligung an einer Kommanditgesellschaft (§ 8 Abs. 3 Z 1 zweiter Teilstrich EStG). Die GmbH muss daher prüfen, ob sie die Voraussetzungen für die Bildung einer Unternehmensgruppe erfüllt.

Hier sind die relevanten Aspekte der §§ 7-12 Körperschaftsteuergesetz (KStG) zu prüfen:

1. **Gruppenbildung**: Die GmbH muss prüfen, ob sie die Voraussetzungen für die Bildung einer Unternehmensgruppe erfüllt (§ 8 Abs. 3 Z 1 zwe"
CORP-TAX-023,"Wenn eine GmbH nach einem Verlustjahr im Folgejahr wieder Gewinn erzielt, sind folgende steuerliche Schritte zu beachten:

1. **Verlustvortrag**: Gemäß § 22 Abs. 1 EStG kann der Verlust des Vorjahres auf den Gewinn des Folgejahres angerechnet werden. Dies gilt jedoch nur, wenn der Verlust nicht bereits in einem anderen Jahr nachversteuert wurde.
2. **Nachversteuerung**: Gemäß § 22 Abs. 1 EStG ist der Verlust des Vorjahres nachzuversteuern, wenn er in einem anderen Jahr nicht bereits nachversteuert wurde. Dies gilt jedoch nicht, wenn der Verlust in Wirtschaftsjahren entstanden ist, die vor dem 1. März 2014 enden, nicht mehr im Ausland verwertet werden können und aus ausländischen Betrieben oder Betriebsstätten stammen, die vor dem 1. Jänner 2017 aufgegeben oder veräußert wurden (§ 22 Abs. 1 EStG).
3. **Zuschreibungsr"
CORP-TAX-024,"Der Gewinnermittlungszeitraum ist das Wirtschaftsjahr (§ 4 EStG). Das Wirtschaftsjahr ist der Zeitraum, in dem die Geschäftstätigkeit eines Unternehmens durchgeführt wird und in dem die Buchhaltung geführt wird.

Nach § 4 Abs. 1 EStG ist der Gewinn der durch doppelte Buchführung zu ermittelnde Unterschiedsbetrag zwischen dem Betriebsvermögen am Schluß des Wirtschaftsjahres und dem Betriebsvermögen am Schluß des vorangegangenen Wirtschaftsjahres.

Der Gewinnermittlungszeitraum kann jedoch in bestimmten Fällen abgewichen werden:

* Wenn ein Unternehmen ein Kreditinstitut im Sinne von Artikel 4 Abs. 1 Unterabs. 1 der Verordnung (EU) Nr. 575/2013 ist, kann es im ersten Geschäftsjahr, das nach dem 31. Dezember 2015 begonnen hat, anstelle von bestehenden Einzelwertberichtigungen eine pauschale Wertberichtigung für Forder"
CORP-TAX-025,"Laut § 4d des Einkommensteuergesetzes 1988 (EStG) werden Einlagen und Beiträge von Gesellschaftern bei der Einkommensermittlung behandelt wie folgt:

- Einlagen und Beiträge von Gesellschaftern sind nicht als Einnahmen zu berücksichtigen, wenn sie nicht über den Nennbetrag hinausgehen (§ 4d Abs. 1 EStG).
- Wenn die Einlagen und Beiträge über den Nennbetrag hinausgehen, sind sie als Einnahmen zu berücksichtigen, es sei denn, sie sind nach § 4d Abs. 2 EStG steuerfrei (z.B. bei Einlagen und Beiträgen, die zur Deckung von Verlusten verwendet werden).

Es ist jedoch zu beachten, dass diese Regelungen nur für die Einkommensermittlung gelten und nicht für die Körperschaftsteuer (KStG) oder die Umsatzsteuer (UStG). Bei der Körperschaftsteuer werden Einlagen und Beitr"
CORP-TAX-026,"Laut § 8 Abs. 4 Z 2 lit. b KStG ist der Verlustabzug nicht auf 75 % begrenzt, wenn die Voraussetzungen des § 96 Abs. 4 Z 2 EStG erfüllt sind. 

Dies bedeutet, dass die Bescheinigung nach § 96 Abs. 4 Z 2 EStG erteilt werden muss, um den Verlustabzug gemäß § 8 Abs. 4 Z 2 lit. b KStG ohne die 75%-Begrenzung vornehmen zu können.

Die Bescheinigung ist zur Vornahme des Verlustausgleichs nach § 95 Abs. 2 Z 2 lit. a EStG erforderlich. 

Daher ist der Verlustabzug gemäß § 8 Abs. 4 Z 2 lit. b KStG nicht auf 75 % begrenzt, wenn die Voraussetzungen des § 96 Abs. 4 Z 2 EStG erfüllt sind."
CORP-TAX-027,"Ich muss leider sagen, dass die Frage nicht direkt mit den angegebenen Gesetzestexten zusammenhängt. Der Gesetzestext bezieht sich auf den Körperschaftsteuer-Veranlagungsverfahren (§ 9 KStG) und die Höchstbeträge für Verlustrückträge, aber nicht direkt auf die Mindestbeteiligungsquote für die finanzielle Verbindung.

Die Mindestbeteiligungsquote für die finanzielle Verbindung im Sinne des § 9 KStG ist jedoch in § 9 Abs. 6 Z 2 KStG geregelt. Hier ist jedoch nicht der gesamte Gesetzestext abgedruckt, daher kann ich nur spekulieren, dass die Mindestbeteiligungsquote 25% ist, da dies in der Praxis üblich ist.

In Österreich ist die Mindestbeteiligungsquote für die finanzielle Verbindung im Sinne des § 9 KStG in der Regel 25%. Dies bedeutet, dass ein Unternehmen mindestens 25% der Anteile an einem anderen Unternehmen halten muss, um eine finanzielle Ver"
CORP-TAX-028,Laut § 7 Abs. 5 EStG muss die finanzielle Verbindung zu einem Gruppenmitglied während des gesamten Wirtschaftsjahres des jeweiligen Gruppenmitglieds vorliegen.
CORP-TAX-029,"Nein, Vorgruppenverluste des Gruppenträgers, die aus Teilwertabschreibungen auf Beteiligungen an Körperschaften einer anderen Unternehmensgruppe stammen, können nicht mit dem Gruppengewinn verrechnet werden.

Gemäß § 8 Abs. 4 Z 2) des KStG können Vorgruppenverluste des Gruppenträgers, die aus Zeiträumen vor dem Wirksamwerden der Unternehmensgruppe stammen, nicht verrechnet werden, soweit in diesen Abschreibungen auf den niedrigeren Teilwert (§ 9) gilt.

Da die Teilwertabschreibungen auf Beteiligungen an Körperschaften einer anderen Unternehmensgruppe unter § 9 fallen, können diese Vorgruppenverluste nicht mit dem Gruppengewinn verrechnet werden.

Zusätzlich ist zu beachten, dass der Verlustrücktrag gemäß § 8 Abs. 4a Z 2) des KStG nur vom Gruppenträger beantragt werden kann, nicht jedoch von den Körperschaft"
CORP-TAX-030,"Basierend auf den angegebenen Gesetzestexten, insbesondere § 98 EStG, § 6 Z 6 lit. c und d EStG und § 99 Abs. 1 Z 1 EStG, kann ich folgende Konsequenz feststellen:

Eine österreichische Körperschaft, die in Österreich und in Deutschland unbeschränkt steuerpflichtig ist und als Gruppenträger fungieren möchte, muss beachten, dass sie die Voraussetzungen für die Gruppenbildung erfüllen muss.

Gemäß § 98 EStG müssen die Einkünfte der Körperschaft im Kalenderjahr mindestens zu 90% der österreichischen Einkommensteuer unterliegen oder die nicht der österreichischen Einkommensteuer unterliegenden Einkünfte nicht mehr als 13 539 Euro betragen. Da die Körperschaft in Deutschland unbeschränkt steuerpflichtig ist, gelten ihre Einkünfte in Deutschland als nicht der österreichischen Einkommensteuer unterliegend.

Um als Gruppenträger zu fung"
CORP-TAX-031,"Vorgruppenverluste sind Verluste, die von einem Gruppenmitglied vor dem Wirksamwerden der Unternehmensgruppe entstanden sind. Diese Verluste können bis zur Höhe des eigenen Gewinnes des jeweiligen Gruppenmitglieds verrechnet werden (§ 8 Abs. 4 Z 2 EStG).

Innerhalb der Gruppe werden Vorgruppenverluste wie folgt behandelt:

- Sie können bis zur Höhe des eigenen Gewinnes des jeweiligen Gruppenmitglieds verrechnet werden.
- Wenn vortragsfähige Verluste innerhalb der Gruppe entstanden sind und umgründungsbedingt auf ein anderes Gruppenmitglied übergehen, liegen keine Außergruppenverluste vor (§ 8 Abs. 4 Z 2 EStG).

Es ist jedoch zu beachten, dass der Verlustrücktrag nur vom Gruppenträger beantragt werden kann (§ 9 Abs. 1 a EStG). Körperschaften, deren Einkommen in der Veranlagung 2019 oder"
CORP-TAX-032,"Laut § 9 Abs. 6 Z 1 EStG werden die zuzurechnenden Verluste nicht unbeschränkt steuerpflichtiger ausländischer Gruppenmitglieder, an denen eine ausreichende finanzielle Verbindung besteht, sowie deren allenfalls nachzuversteuernde Verluste, in einem bestimmten Ausmaß berücksichtigt.

**Höhe der Verlustverrechnung:**

- Bei einem inländischen Gruppenmitglied (§ 5 Abs. 1 EStG) können die Verluste höchstens 75% der Summe der eigenen Einkommen sämtlicher unbeschränkt steuerpflichtiger Gruppenmitglieder sowie des Gruppenträgers betragen.
- Bei einem ausländischen Gruppenmitglied (§ 9 Abs. 6 Z 1 EStG) können die Verluste jedoch nur im Ausmaß von 75% der Summe der eigenen Einkommen sämtlicher unbeschränkt steuerpflichtiger Gruppenmitglieder sowie des Gruppenträgers berücksichtigt"
