id,answer
ESTG-NEW-012,"Herr Pfeifer hat leider nicht ganz Recht. Die Anwendung des Sondersteuersatzes von 27,5 % gemäß § 27b EStG ist nicht möglich, da die Kryptowährungen (BTC) nicht als ""Sondergut"" im Sinne des § 27b EStG gelten.

Gemäß § 5 EStG beträgt der Gewinn der protokollierten Gewerbetreibenden (hier: Herr Pfeifer als Einzelunternehmer) nicht mehr als 40 Millionen Euro. Da Herr Pfeifer den Gewinn aus dem Verkauf der BTC nicht als Gewinn aus Gewerbebetrieb, sondern als Gewinn aus der Veräußerung von Vermögensgegenständen (§ 24 EStG) betrachten kann, ist die Anwendung des Sondersteuersatzes von 27,5 % nicht möglich.

Der Gewinn aus der Veräußerung von Vermögensgegenständen wird gemäß § 24 EStG mit dem allgemeinen Steuersatz von 25 % oder 35 % besteuert, je nachdem, ob die Verm"
ESTG-NEW-013,"Basierend auf den gegebenen Gesetzestexten und der Beschreibung der Token-Migration, kann ich folgende Schlussfolgerung ziehen:

Die Token-Migration von SynthX-Token zu SynthX-v2-Token ist ein Tauschvorgang, bei dem die wirtschaftliche Funktion und die Governance-Rechte identisch bleiben. Der Marktwert der Token beträgt zum Migrationszeitpunkt EUR 50 pro Token, während die ursprünglichen Anschaffungskosten EUR 10 pro Token betragen.

Gemäß § 22 Abs. 1 KStG 1988 ist ein Tausch steuerpflichtig, wenn die wirtschaftliche Funktion und die Governance-Rechte der getauschten Werte identisch bleiben und der Marktwert der getauschten Werte erheblich höher ist als der ursprüngliche Anschaffungswert.

In diesem Fall liegt ein steuerpflichtiger Tausch vor, da die wirtschaftliche Funktion und die Governance-Rechte der SynthX-Token und der SynthX-v2-Token identisch bleiben und der Marktwert der SynthX-v2-Token (EUR"
ESTG-NEW-014,"Die Frage ist komplex und erfordert eine sorgfältige Analyse der gesetzlichen Bestimmungen. Ich werde mich bemühen, eine präzise Antwort zu geben.

**Rebase-Einkünfte**

Der Rebase-Mechanismus führt zu einer automatischen Zunahme der stETH in Herrn Steiners Wallet, ohne dass eine separate Gutschrift erfolgt. Dieser Vorgang kann als eine Art ""automatische Zinsen"" auf die gestakten ETH angesehen werden.

Gemäß § 27 Abs. 3 und 4 EStG ist die Geltendmachung der Prämie für die Anschaffung von Erfassungseinheiten (in diesem Fall stETH) durch Antragstellung in der jeweiligen Einkommensteuererklärung möglich. Die Prämie beträgt 200 Euro pro Erfassungseinheit, maximal aber 30 Euro pro Erfassungseinheit im Falle eines elektronischen Kassensystems.

Da der Rebase-Mechanismus zu einer automatischen Zunahme der stETH führt, ohne dass eine separate Gutschrift erfolgt, kann dies"
ESTG-NEW-015,"Frau Hofer ist leider falsch. Die Tausche von Stablecoins untereinander sind steuerbar, da es sich um Einkünfte aus Kryptowährungen handelt. Gemäß § 3 WAG 2018 (Wertsteuerabkommen) ist der inländische Dienstleister für die Besteuerung zuständig.

Die Tausche von Stablecoins untereinander ist eine ""laufende Einnahme"" im Sinne des § 3 WAG 2018, da es sich um eine Gegenleistung für die Übertragung von Kryptowährungen handelt. Der inländische Dienstleister ist in diesem Fall die österreichische Börse, auf der Frau Hofer die restlichen 5.000 USDT gegen EUR getauscht hat.

Die Tausche von Stablecoins untereinander ist nicht wie ein ""echter"" Kursgewinn zu betrachten, da der Marktwert der Stablecoins gleich bleibt. Es handelt sich jedoch um eine Einnahme im Sinne des Steuerrechts, da Frau Hofer durch die Tausche einen Vermögenswert in Form"
ESTG-NEW-016,"Die steuerlichen Folgen der Einlage, der Entnahme und des Verkaufs der 10 ETH durch Herrn Novak können wie folgt zusammengefasst werden:

1. **Einlage der 20 ETH in das Betriebsvermögen der Einzelfirma im Jänner 2026:**
Die Einlage der 20 ETH in das Betriebsvermögen der Einzelfirma ist steuerneutral, da es sich um eine Einlage in ein Unternehmen handelt. Der Marktwert der 20 ETH zum Zeitpunkt der Einlage beträgt EUR 64.000 (20 x EUR 3.200).

2. **Entnahme von 10 ETH aus dem Betriebsvermögen im Juni 2026:**
Die Entnahme von 10 ETH aus dem Betriebsvermögen der Einzelfirma ist steuerpflichtig, da es sich um eine Rückzahlung von Eigenkapital handelt. Der Marktwert der 10 ETH zum Zeitpunkt der Entnahme beträgt EUR 35.000 (10 x EUR 3.500).

Die steuerliche Behandlung der Entnahme von 10 ETH aus dem"
ESTG-NEW-017,"Um die Anschaffungskosten und die steuerliche Behandlung des Verkaufs der 3 BTC zu bestimmen, müssen wir die relevanten Gesetze und Vorschriften berücksichtigen.

Die Übergangsregelung des ökologisch-sozialen Steuerreformgesetzes 2022 (BGBl. I Nr. 113/2022) regelt die Anschaffungskosten von Kryptowährungen, die vor dem 1. März 2021 angeschafft wurden. Gemäß § 4 Abs. 1 dieser Übergangsregelung sind die Anschaffungskosten für Kryptowährungen, die vor dem 1. März 2021 angeschafft wurden, mit dem Marktwert zum Zeitpunkt der Anschaffung anzusetzen.

In diesem Fall hatte Frau Wimmers Tante die 3 BTC im Februar 2021 zu EUR 35.000 pro Stück angeschafft. Da dies vor dem 1. März 2021 geschah, gelten die Übergangsregeln, und die Anschaffungskosten"
ESTG-NEW-018,"Herr Zach kann einen Verlust aus Kryptowährungen nach § 27 Abs. 8 EStG geltend machen. 

Gemäß § 27 Abs. 8 EStG können Verluste aus der Veräußerung von Kryptowährungen, die nicht als Wertpapiere im Sinne des § 1 Abs. 1 Z 4 KAGG gelten, nur dann geltend gemacht werden, wenn die Kryptowährung auf einem inländischen Kreditinstitut gegen sofortige volle Zahlung der Anschaffungskosten erworben wurde und durch mindestens zehn Jahre ab der Anschaffung hinterlegt wurde.

Da Herr Zach die Token auf einer zentralisierten Kryptobörse (CEX) hält, handelt es sich nicht um eine inländische Kreditinstitut, sondern um eine Börse. Daher kann Herr Zach keinen Verlust nach § 27 Abs. 8 EStG geltend machen.

Allerdings kann Herr Zach den Verlust als Verlust aus der Veräußerung von Vermögenswerten geltend machen."
ESTG-NEW-019,"Nein, Herr Brandstätter ist der Ansicht, dass der gesamte Reverse Split kein steuerlich relevanter Vorgang ist, aber das stimmt nicht.

Der Reverse Stock Split ist ein steuerlich relevanter Vorgang, da er zu einer Änderung der Anschaffungskosten der Aktien führt. Gemäß § 6 Abs. 3 Z 4 lit. a des Beteiligungsfondsgesetzes unterliegen die Anschaffungskosten der Aktien, die den Ausgabebetrag (Nennbetrag und ein Aufgeld) betreffen, besonderen Regeln.

Bei einem Reverse Stock Split werden die Anschaffungskosten der Aktien, die durch den Split nicht glatt teilbar sind, in eine Barabfindung umgewandelt. In diesem Fall erhält Herr Brandstätter eine Barabfindung von EUR 250 für seine 5 ""überschüssigen"" Aktien.

Die Barabfindung ist ein steuerpflichtiger Betrag, da sie als Einkünfte aus Kapitalvermögen gilt. Gemäß § 27a Abs"
ESTG-NEW-020,"Die Frage ist komplex und erfordert eine Analyse der steuerlichen Behandlung von Kryptowährungen in Österreich. Hier ist meine Antwort:

In Österreich werden Kryptowährungen als Vermögensgegenstände behandelt und unterliegen der Einkommensteuer. Gemäß § 2 Abs. 1 EStG sind Einkünfte aus Vermögensverwaltung steuerpflichtig, wenn sie nicht aus einem selbstständigen Gewerbe oder einer Land- oder Forstwirtschaft stammen.

Die Staking-Rewards, die Frau Kern erhält, sind Einkünfte aus Vermögensverwaltung, da sie aus der Verwaltung ihrer Kryptowährung (DOT) stammen. Gemäß § 108c Abs. 9 EStG können Aufwendungen für die betriebliche Nutzung eines Kraftfahrzeuges, Kraftrades oder Fahrrades pauschal berücksichtigt werden. Es gibt jedoch keinen entsprechenden Paragraphen, der die steuerliche Behandlung von Kryptowährungen regelt.

In diesem Fall ist die steuerliche Behandlung von Kryptow"
VAT-DOM-001,"Nein, der Marktplatz wird nicht umsatzsteuerlich so behandelt, als ob er die Gegenstände selbst erhalten und geliefert hätte. 

Gemäß § 3 Abs. 8a) EStG werden Unternehmer, die die Lieferung von Gegenständen innerhalb der Gemeinschaft durch einen Unternehmer, der im Gemeinschaftsgebiet weder sein Unternehmen betreibt noch eine Betriebsstätte hat, an einen Nichtunternehmer durch die Nutzung einer elektronischen Schnittstelle, beispielsweise eines Marktplatzes, einer Plattform, eines Portals oder Ähnlichem, unterstützen, behandelt, als ob sie diese Gegenstände selbst erhalten und geliefert hätten. 

Allerdings handelt es sich bei der Lieferung von Kopfhörern an eine Privatperson in Österreich durch einen chinesischen Händler über einen Online-Marktplatz um eine Ausfuhrlieferung, da der Gegenstand der Lieferung aus dem Drittlandsgebiet nach Österreich versendet wird. 

Gemäß § 3 Abs. 8a) ESt"
VAT-DOM-002,"Basierend auf den angegebenen Gesetzestexten, insbesondere § 25b Abs. 9 EStG, wird die Beförderung der Ware von Polen nach Österreich der Lieferung von A an B zugeordnet.

Der Grund dafür liegt darin, dass B die Beförderung organisiert hat und A seine polnische Umsatzsteuer-Identifikationsnummer mitgeteilt hat. Dies bedeutet, dass A als Lieferer der Ware gilt, die in das Drittlandsgebiet (Polen) versandt oder befördert wird.

Da die Ware unmittelbar von Polen nach Österreich befördert wird, gilt § 25b Abs. 9 EStG, der besagt, dass die Lieferung als im Einfuhrland ausgeführt zu behandeln ist, wenn der Lieferer (A) oder sein Beauftragter (B) Schuldner der bei der Einfuhr zu entrichtenden Umsatzsteuer ist.

In diesem Fall ist B der Beauftragte von A, da er die Beförderung organisiert hat und"
VAT-DOM-003,"Basierend auf den angegebenen Gesetzestexten, insbesondere § 6 Abs. 1 Z 8 lit. j EStG, § 5 EStG und § 1 Abs. 1 Z 1 UStG, kann ich folgende Antwort geben:

Die Übergabe des fertigen Schmuckstücks durch den Unternehmer an den Auftraggeber stellt eine Lieferung gemäß § 1 Abs. 1 Z 1 UStG dar. Die Lieferung von Anlagegold an einen anderen Unternehmer ist gemäß § 6 Abs. 1 Z 8 lit. j EStG steuerpflichtig.

Die Übergabe des fertigen Schmuckstücks ist jedoch keine Lieferung von Anlagegold, sondern eine Lieferung eines Schmuckstücks. Da der Unternehmer Feingold zur Herstellung des Schmuckstücks erhalten hat, kann dies als eine Lieferung von Anlagegold angesehen werden, die gemäß § 6 Abs. 1 Z 8 lit. j EStG steuerpflichtig ist.

Da der Unternehmer jedoch nicht genau aus"
VAT-DOM-004,"Um den Leistungsort der weiterverrechneten Eintrittsberechtigungen zu bestimmen, müssen wir die Vorschriften des Umsatzsteuergesetzes (UStG) und des Bürgerlichen Gesetzbuches (BGB) heranziehen.

Gemäß § 3 Abs. 1 UStG ist der Leistungsort der Ort, an dem der Leistungsempfänger seinen Wohnsitz, Sitz oder eine Betriebsstätte hat. Wenn der Leistungsempfänger jedoch keinen Wohnsitz, Sitz oder eine Betriebsstätte in einem Mitgliedstaat der Europäischen Union (EU) hat, ist der Leistungsort der Ort, an dem der Unternehmer seinen Sitz oder eine Betriebsstätte hat (§ 3 Abs. 2 UStG).

In diesem Fall handelt es sich um eine schweizerische Gesellschaft, die Eintrittsberechtigungen für eine Fachmesse in Wien weiterverkauft. Der Leistungsempfänger ist eine deutsche GmbH, die ihren Sitz in Deutschland hat. Da die deutsche"
VAT-DOM-005,"Nach § 3 Abs. 8a) UStG gilt die Lieferung als dort ausgeführt, wo die Beförderung oder Versendung endet, wenn der Gegenstand in einem anderen Mitgliedstaat eingeführt wird, als jenem, in dem die Beförderung oder Versendung endet.

Da der Livestream von Österreich aus an eine Privatperson in Spanien übertragen wird, gilt die Lieferung als dort ausgeführt, wo die Beförderung oder Versendung endet, also in Spanien.

Der Leistungsort ist also Spanien, da der Gegenstand (der Livestream) in einem anderen Mitgliedstaat (Spanien) eingeführt wird, als jenem, in dem die Beförderung oder Versendung endet (Österreich).

Es ist jedoch zu beachten, dass § 103 EStG eine Ausnahme für Personen vorsieht, deren Zuzug aus dem Ausland der Förderung von Wissenschaft, Forschung, Kunst oder Sport dient und aus diesem Grunde im öffentlichen Interesse gelegen ist. Wenn der"
VAT-DOM-006,"Die Frage ist komplex und erfordert eine sorgfältige Analyse der gesetzlichen Bestimmungen. Hier ist meine Antwort:

Gemäß § 3 Abs. 8 UStG ist die Lieferung des Verarbeiters auf den gesamten ursprünglichen Silbergehalt des übergebenen Materials auszurichten, wenn die Voraussetzungen für ein Reihengeschäft nach § 3 Abs. 15 UStG erfüllt sind.

Ein Reihengeschäft liegt vor, wenn dieselben Gegenstände nacheinander geliefert werden und diese Gegenstände unmittelbar vom ersten Lieferer bis zum letzten Abnehmer (Empfänger) in der Reihe befördert oder versendet werden (§ 3 Abs. 15 Z 5 UStG).

In diesem Fall ist der Auftraggeber der erste Lieferer, der Silbergranulat an den Verarbeiter liefert. Der Verarbeiter ist der zweite Lieferer, der die Silbergranulat verarbeitet und die Silberreste und Schleifabfälle zurückgibt. Der Auf"
VAT-DOM-007,"Nach § 3 Abs. 8 Z 2 EStG gilt die Lieferung als ausgeführt, wenn der Unternehmer das Umsatzgeschäft, das seiner Lieferung zugrunde liegt, mit einem ausländischen Abnehmer abgeschlossen hat, und der Abnehmer den Gegenstand der Lieferung in das Drittland befördert oder versendet hat.

Da der Flug von Wien nach Madrid ohne Zwischenaufenthalt außerhalb des Gemeinschaftsgebiets verläuft, gilt die Lieferung als ausgeführt, wenn der Abnehmer (der Passagier) den Gegenstand der Lieferung (das Parfum) in das Drittland (Spanien) befördert oder versendet hat.

Der Ort der Lieferung ist jedoch nicht in Spanien gelegen, da die Lieferung bereits während des Fluges stattgefunden hat und der Passagier das Flugzeug noch nicht verlassen hat. Der Ort der Lieferung ist daher der Ort, an dem die Lieferung erfolgt ist, also an Bord des Flugzeugs.

Nach § 3 Abs. 8 Z 3"
VAT-DOM-008,"Die Frage ist nicht direkt mit dem angegebenen Gesetzestext zusammenhängend, aber ich werde versuchen, eine Antwort zu geben, die auf den gegebenen Informationen basiert.

Gemäß § 2 Abs. 2 UStG ist der Ort der Lieferung der Ort, an dem der Warenempfänger seinen Wohnsitz oder Sitz hat, wenn der Warenempfänger ein Unternehmer ist und die Lieferung nicht an eine besondere Betriebsstätte erfolgt.

In diesem Fall ist der italienische Wiederverkäufer ein Unternehmer, der Elektrizität erwerbt und weiterliefernt. Der Eigenverbrauch ist nur von untergeordneter Bedeutung. Da der Strom nicht an eine besondere Betriebsstätte geliefert wird, liegt der Ort der Lieferung in Italien, wo der italienische Wiederverkäufer seinen Sitz hat.

Der physische Einbau des Stroms in das italienische Stromnetz ist für die Bestimmung des Ortes der Lieferung nicht relevant. Der Ort der Lieferung ist daher Italien"
VAT-DOM-009,"Nein, die Verwendung des Bürogebäudes durch den Unternehmer für private Zwecke wird nicht nach § 3a Abs. 1a Z 1 einer sonstigen Leistung gegen Entgelt gleichgestellt.

§ 3a Abs. 1a Z 1 EStG regelt die Befreiung von der Umsatzsteuer für bestimmte Leistungen, darunter auch die Überlassung von Grundstücken an Mitunternehmer oder die Überlassung von Grundstücken, die zum Sonderbetriebsvermögen gehören. Diese Befreiung gilt jedoch nur, wenn die Grundstücke unentgeltlich überlassen werden und der Übergeber mindestens zu einem Viertel unmittelbar am Vermögen der Gesellschaft beteiligt ist.

In diesem Fall wird das Bürogebäude jedoch nicht unentgeltlich überlassen, sondern es wird privat genutzt, nachdem es bereits zum Unternehmen gehört hat. Die private Nutzung des Bürogebäudes ist keine Überlassung an einen Mitunternehmer oder keine Überlassung zum Sonderbetriebsvermögen, sondern eine private Verwendung des"
VAT-DOM-010,"Nein, der Ort der Lieferung liegt nicht in Österreich. Gemäß § 3 Abs. 8 UStG liegt die Lieferung an einem ausländischen Abnehmer vor, wenn der Abnehmer den Gegenstand der Lieferung in das Drittland befördert oder versendet hat. In diesem Fall wird die Maschine von Zürich nach Graz transportiert, also in das Inland, aber der österreichische Kunde erlangt die Verfügungsmacht erst nach Ankunft in Graz. Der Ort der Lieferung ist also der Ort, an dem die Maschine sich bei Verschaffung der Verfügungsmacht befindet, nämlich in Graz.

Es ist jedoch zu beachten, dass der österreichische Kunde nicht der ausländische Abnehmer ist, sondern der Käufer, der die Maschine in Österreich erlangt. Der ausländische Abnehmer ist der Schweizer Unternehmer, der die Maschine an den österreichischen Kunden verkauft hat. Der Schweizer Unternehmer hat die Maschine in Zürich an den Spediteur übergeben, der sie nach Graz transportiert hat. Daher liegt die"
VAT-DOM-011,"Nein, die Lieferung des Produzenten an den Kommissionär gilt noch nicht als ausgeführt. Gemäß § 25b Abs. 9 EStG gilt eine Lieferung als im Einfuhrland ausgeführt, wenn der Lieferer oder sein Beauftragter Schuldner der bei der Einfuhr zu entrichtenden Umsatzsteuer ist. In diesem Fall ist der Kommissionär der Schuldner der Umsatzsteuer, da er die Waren im eigenen Namen, aber für Rechnung des Produzenten verkaufen soll. Die Lieferung gilt jedoch noch nicht als ausgeführt, da die Waren noch nicht an den Endkunden verkauft wurden.

Es ist jedoch zu beachten, dass die Lieferung des Produzenten an den Kommissionär als eine Art ""Einfuhr-Versandhandel"" gilt, da die Waren durch den Kommissionär oder für dessen Rechnung vom Drittlandsgebiet in einen Mitgliedstaat versandt oder befördert werden. Gemäß § 25b Abs. 1 EStG gilt ein Einfuhr-Versand"
VAT-DOM-012,"Basierend auf den angegebenen Gesetzestexten ist die Leistung als Lieferung zu behandeln.

Der Unternehmer hat vom Auftraggeber beigestellten Stahl verarbeitet und dabei zusätzliche Motoren und Steuerungseinheiten verwendet, die nicht bloß Zutaten oder Nebensachen sind. Dies deutet darauf hin, dass der Unternehmer die Motoren und Steuerungseinheiten als eigenes Produktionsmittel verwendet hat, um die Produktionsanlage herzustellen.

Gemäß § 3 Abs. 1 EStG ist eine Lieferung eine Leistung, durch die ein Unternehmer den Abnehmer oder in dessen Auftrag einen Dritten befähigt, im eigenen Namen über einen Gegenstand zu verfügen. In diesem Fall hat der Unternehmer die Motoren und Steuerungseinheiten verwendet, um die Produktionsanlage herzustellen, die dann an den Auftraggeber geliefert wird.

Die Tatsache, dass die fertige Anlage fest mit dem Boden der Fabrikhalle verbunden ist, ist für die steuerliche Behandlung nicht relevant. Die Lieferung wird nicht durch die"
VAT-DOM-013,"Die Frage ist ein bisschen verwirrend, da sie sich auf die Lieferung von Elektrizität bezieht, aber die relevanten Gesetze und Paragraphen sind nicht direkt im Energiebereich zu finden. Die Antwort hängt eher von der Definition des ""Orts der Lieferung"" ab.

Gemäß § 3 Abs. 1 UStG (Umsatzsteuergesetz) ist der Ort der Lieferung der Ort, an dem der Leistungsempfänger seinen gewöhnlichen Aufenthalt hat. Wenn der Leistungsempfänger (die österreichische Papierfabrik) in Österreich ihren gewöhnlichen Aufenthalt hat, ist der Ort der Lieferung Österreich.

Allerdings gibt es eine Ausnahme gemäß § 3 Abs. 2 UStG, wenn der Leistungsempfänger in einem anderen Mitgliedstaat der EU oder in einem anderen Vertragsstaat des EWR seinen gewöhnlichen Aufenthalt hat und der Lieferer (der deutsche Energieversorger) in Österreich einen steuerpflichtigen Umsatz erzielt."
VAT-DOM-014,"Gemäß § 108 ASVG (Arbeitslosenversicherungsgesetz) und § 25 EStG (Einkommensteuergesetz) ist die Entsendung von Arbeitnehmern in das Ausland steuerfrei, wenn bestimmte Voraussetzungen erfüllt sind. Allerdings bezieht sich dieser Gesetzestext auf die Entsendung von Arbeitnehmern und nicht auf die Vermittlung von Geschäften.

Für die Vermittlung von Geschäften ist § 25 EStG nicht direkt anwendbar. Stattdessen ist § 3 Abs. 8 EStG relevant, der Einkünfte aus Kapitalvermögen definiert. Allerdings bezieht sich dieser Paragraph auch nicht direkt auf die Vermittlung von Geschäften.

Die richtige Antwort auf die Frage ist § 3 Abs. 8 EStG, aber nur in Bezug auf die Definition von Einkünften aus Kapitalvermögen. Die Vermittlung von Geschäften ist jedoch nicht explizit in diesem Paragraphen geregelt.

Um die Frage zu beantworten, müssen wir uns"
VAT-DOM-015,"Nein, der Leistungsort liegt nicht in Österreich. Gemäß § 29 Abs. 2 der Bundesabgabenordnung gilt auch der Heimathafen österreichischer Handelsschiffe als Betriebsstätte, wenn die Reederei im Inland keine Niederlassung hat. Da das Boot jedoch nicht österreichisch ist, sondern kroatisch, und die Vermietung von einem kroatischen Bootsvermieter in Split erfolgt, ist der Leistungsort Split, Kroatien.

Der Wohnsitz der Kundin in Österreich ist für die Bestimmung des Leistungsorts nicht relevant. Der Leistungsort wird durch den Ort bestimmt, an dem die Leistung erbracht wird, also in diesem Fall Split, Kroatien."
VAT-DOM-016,"Basierend auf den angegebenen Gesetzestexten, insbesondere § 15 Abs. 2 Z 1) EStG, kann ich folgende Antwort geben:

Ja, bereits eine Lieferung liegt vor, obwohl das Eigentum noch nicht übergegangen ist. Der Maschinenhändler hat die CNC-Anlage dem Kunden bereits übergeben und dieser darf sie bereits uneingeschränkt in seinem Betrieb einsetzen, weitervermieten und im eigenen Namen darüber verfügen.

Gemäß § 15 Abs. 2 Z 1) EStG gilt die unentgeltliche Abgabe als zugeflossen, wenn der Arbeitnehmer (in diesem Fall der Maschinenhändler) die Anteile veräußert. Die Rückübertragung der Anteile an den Arbeitgeber gilt insbesondere in Zusammenhang mit der Beendigung des Dienstverhältnisses als Veräußerung.

In diesem Fall liegt jedoch keine Beendigung des Dienstverhältnisses vor, sondern ein Verkauf der CNC-Anlage an den Kunden. Dennoch gilt die Übergabe der An"
VAT-DOM-017,"Basierend auf dem Gesetzestext, insbesondere § 3 Abs. 6 EStG, kann ich folgende Antwort geben:

Eine Bearbeitung oder Verarbeitung im Sinne des § 3 Abs. 6 EStG liegt vor, wenn der Unternehmer die Messingplatten in einem Wege bearbeitet oder verarbeitet, der zu einer Änderung der Marktgattung führt. Dies ist jedoch nicht der Fall, da die Platten nach der Behandlung weiterhin nur als Messingplatten derselben Marktgattung verkauft werden können.

Gemäß § 3 Abs. 6 EStG liegt eine Bearbeitung oder Verarbeitung vor, wenn der Unternehmer den Gegenstand in einem Wege bearbeitet oder verarbeitet, der zu einer Änderung der Marktgattung führt. Eine Änderung der Marktgattung liegt jedoch nicht vor, wenn der Gegenstand nach der Bearbeitung weiterhin nur als Gegenstand derselben Marktgattung verkauft werden kann.

In diesem Fall liegt keine Bearbeitung oder Verarbeitung im Sinne des § 3 Abs."
VAT-DOM-018,"Die Frage nach dem Leistungsort ist entscheidend für die Bestimmung der Umsatzsteuerpflicht. Gemäß § 3 Abs. 1 UStG ist der Leistungsort der Ort, an dem der Leistungsempfänger seinen Sitz oder seine Niederlassung hat, wenn die Leistung an diesen Ort bestimmt ist und dort tatsächlich verwendet wird.

In diesem Fall ist die Leistung für die italienische Betriebsstätte der AG bestimmt und wird dort tatsächlich verwendet. Der Sitz der AG in Wien ist nicht der Leistungsempfänger, sondern nur der Sitz der Gesellschaft. Daher liegt der Leistungsort nicht in Österreich, sondern in Italien.

Gemäß § 3 Abs. 2 UStG ist der Leistungsort auch der Ort, an dem die Leistung tatsächlich erbracht wird, wenn der Leistungsempfänger seinen Sitz oder seine Niederlassung nicht in einem Mitgliedstaat der Europäischen Union hat. Da die Leistung in Italien tatsächlich erbracht wird, liegt der Leistungsort auch in Italien."
VAT-DOM-019,"Basierend auf den angegebenen Gesetzestexten, insbesondere § 14 Abs. 1 Z 1 WEG, kann ich folgende Antwort geben:

Die Grundstückseigentümerin erhält ein Entgelt für die Duldung der Nutzung eines gemeinsamen Zufahrtswegs durch den Nachbarn. Da es sich dabei um eine Leistung handelt, die nicht durch die Übertragung eines Gegenstands gekennzeichnet ist, kann es sich um eine sonstige Leistung handeln.

§ 14 Abs. 1 Z 1 WEG regelt die Steuerbefreiung für den Erwerb eines Grundstücks durch Ehegatten oder eingetragene Partner, wenn das Grundstück als Hauptwohnsitz gedient hat. Dieser Paragraph ist jedoch nicht direkt anwendbar auf die Situation, da es sich nicht um einen Erwerb eines Grundstücks handelt.

§ 14 Abs. 2 WEG regelt die Steuerbefreiung bei der Teilung eines Grundstücks unter Miteigentümern. Auch dieser Paragraph ist nicht direkt anwendbar.

§ 26"
VAT-DOM-020,"Basierend auf den angegebenen Gesetzestexten, insbesondere § 103 EStG und § 5 Z 6 EStG, kann ich folgende Antwort geben:

Der Leistungsort der technischen und wirtschaftlichen Beratung durch das österreichische Ingenieurbüro liegt im Inland, da die Beratung im Inland genutzt und ausgewertet wird. Der Umstand, dass der Empfänger, der schweizerische Kanton, in der Schweiz sitzt, ist für die Bestimmung des Leistungsorts nicht relevant.

Gemäß § 1 Abs. 1 UStG ist der Leistungsort der Lieferung oder der sonstigen Leistung der Ort, an dem der Leistungsempfänger seinen Wohnsitz, Sitz oder eine Betriebsstätte hat. Da der Empfänger in diesem Fall der schweizerische Kanton ist, der nichtunternehmerisch tätig ist, ist der Leistungsort nicht in der Schweiz, sondern im Inland.

Da der Leistungsort im Inland liegt, ist die Umsatzsteuer nach österreichischem Recht an"
